,"Tarawati Memorial Degree College, Bringali (Id: C-29261)"
www.gcpojewal.com,"The Prinicipal M.B.G.Govt College, Pojewal (Id: C-29263)"
paruledusociety.org,"APS College of Nursing,  VPO Malsian, Distt.  Jalandhar (Id: C-29188)"
,"Army College of Nursing,  C/o Military Hospital,  Jalandhar Cantt (Id: C-29235)"
www.bmdnursing.com,"BHAI MATI DASS COLLEGE OF NURSING, GORAYA (Id: C-52379)"
www.bharatcollegeofnursing.com,"Bharat Institute of Nursing  Training, Jalandhar  Nakodar Road, VPO  Mundh, Distt. Jalandhar (Id: C-29117)"
www.davrehabilitation.org,"DAV Institute of Physiotherapy & Rehabilitation, MHRM, G.T. Road, Jalandhar (Id: C-29142)"
www.gdhinstiute.com,"Lala Lajpat Rai Institute of  Nursing Education, Gulab  Devi Hospital, Jalandhar (Id: C-29224)"
,"Mahatma Hans Raj DAV  Institute of Nursing &  Hospital,  MHRM, G.T.  Road, Jalandhar (Id: C-29144)"
www.mgin.org,"Mata Gujri Institute of  Nursing, Village  Mehmadpur, P.O.   Adampur, Distt. Jalandhar (Id: C-29170)"
www.phoenixnursinginstitute.org,"Phoneix, The Global Institute of Nursing, Vill. Rampur, Lambra (Id: C-29120)"
www.pimsj.com,"PUNJAB INSTITUTE OF MEDICAL SCIENCES, JALANDHAR (Id: C-46108)"
,"Saint Soldier College of Physiotherapy & Rehabilitation, Basant Vihar, Nakodar Road, VPO Khambra (Jalandhar) (Id: C-29194)"
www.sbbs.edu.in,"Sant Baba Bhag Singh  Institute of Nursing,  Village Khiala, PO  Pandhiana, Distt.  Jalandhar (Id: C-29212)"
www.sglnursing.org,"SGL College of Nursing,  Village Semi, P.O.  Khajurala, Distt. Jalandhar (Id: C-29200)"
www.acfa.apeejay.edu,APJ College of Fine Arts Jalandhar (Id: C-27900)
www.bdarya.net,B D Arya Girls College Jalandhar (Id: C-27871)
www.ctgroup.in,CT College of Education Jalandhar. (Id: C-27948)
www.ctgroup.in,"CT Institute of Higher Studies, Jalandhar (Id: C-51718)"
www.davjalandhar.com,D.A.V.College Jalandhar (Id: C-27912)
www.doabacollege.net,Doaba College Jalandhar (Id: C-27958)
WWW.davphillaur85.com,DRV DAV Centenary College Phillaur (Jalandhar) (Id: C-27950)
www.ggsgovtcoljandiala.com,GGS Govt.College  Jandiala (Jalandhar) (Id: C-27851)
www.gnducjal.org,"GND University College, Near Govt. College of Edu., Ladowali Rd. (Id: C-27988)"
gnkcdarolikalan.com,GN Khalsa College Daroli Kalan (Jalandhar) (Id: C-27977)
www.gnkgcbabasangdhesian.org,"GN Khalsa Girls College, Baba Sang Dhesian (Jalandhar) (Id: C-27847)"
www.gnncwnakodar.org,GN National College for Women Nakodar (Id: C-27973)
www.gnncnakodar.com,GN National College Nakodar (Id: C-27859)
sportscollegejalandhar.com,"Govt.  Arts & Sports College , Jalandhar (Id: C-27855)"
www.gcejalandhar.com,Govt. College of Education Jalandhar (Id: C-27873)
gndu.ac.in,Guru Nanak Dev University Regional Campus (Id: C-27969)
www.hrmmv.org,"Hans Raj Mahila Maha Vidyalaya, Jalandhar (Id: C-27957)"
www.ihgi.in,"Innocent Heart College of Education, Green Model Town,  Jalandhar (Id: C-27903)"
www.kmvjalandhar.ac.in,Kanya Maha Vidyalaya Jalandhar (Id: C-27898)
www.kcllaws.com,"KCL Institute of Law, Jalandhar. (Id: C-27910)"
www.krmdavcollege.com,KRM DAV College Nakodar (Id: C-27858)
lkcwedu.com,"Lyallpur Khalsa College of Education For Women, Jalandhar (Id: C-27979)"
www.lkcwj.com,Ly. Khalsa College for Women Jalandhar (Id: C-27902)
www.lkcjal.org,Ly. Khalsa College  Jalandhar (Id: C-27849)
www.mgncollege.org,MGN College of Education Jalandhar (Id: C-27874)
www.mgsmjantacollege.org,MGSM Janta College Kartarpur (Id: C-27923)
www.ctgroup.in,"M.K. College of Education, Vill. Shahpur, PO Udhopur,   Via Jamsher Khas, Jalandhar (Id: C-27883)"
,M.R.S. Punjab Police Academy Phillaur (Id: C-27961)
www.pced.in,"Paradise College of Education, Gita Colony, Kala Sangian Road, Jalandhar. (Id: C-27860)"
www.pcmsdcollegeonline.com,PCM SD College for Women Jalandhar (Id: C-27947)
www.ptmaryacollege.com,"P.T.M. Arya College,  Noor Mehal (Jalandhar). (Id: C-27939)"
stsoldiergroup.in,"Saint Soldier Law College, Behind R.E.C.(N.I.T.),  Jalandhar. (Id: C-27880)"
,"Sant Baba Bhag Singh Institute of Education, Vill. Khiala P.O.Padhiana, Near Adampur Doaba, Jalandhar (Id: C-28001)"
,"St.Soldier College  Basti  Danashmandan, Jalandhar (Id: C-27890)"
,ST.SOLDIER COLLEGE (CO-ED) (Id: C-51343)
www.ssced.in,St. Soldier College of Education Behind  REC (NIT) Jalandhar. (Id: C-27997)
www.trinitycollegejal.com,"Trinity College, Church Nagar, G.G.S.Avenue,Chogitti Jalandhar (Id: C-27928)"
www.davayurveda.com,"Dayanand Ayurvedic College, Mahatma Hans Raj Marg, G.T. Road, Jalandhar (Id: C-29116)"
www.apeejay.edu,"Apeejay Institute of Management, Jalandhar (Id: C-10383)"
www.ctgroup.in,CT INSTITUTE OF ARCHITECTURE AND PLANNING (Id: C-52112)
www.ctgroup.in,"CT Institute of Engg. Management and Technology, Shahpur (Id: C-10378)"
www.ctgroup.in,CT Institute of Hospitality Management (Id: C-52302)
www.ctgroup.in,CT Institute of Hotel Management and Catering Technology (Id: C-10452)
www.ctgroup.in,"CT Institute of Management and IT , Jalandhar (Id: C-10429)"
www.ctgroup.in,"CT Institute of Management Studies , Shahpur (Id: C-10458)"
http://www.ctgroup.in,"CT Institute of Management & Technology, Shahpur (Id: C-10416)"
www.ctgroup.in,"CT Institute of Pharmaceutical Sciences, Shahpur (Id: C-10300)"
www.ctgroup.in,CT INSTITUTE OF TECHNOLOGY AND RESEARCH (Id: C-52061)
www.ctgroup.in,"CT Institute of Technology, Shahpur (Id: C-10394)"
www.davietjal.org,"DAV Institute of Engineering and Technology, Jalandhar (Id: C-10384)"
www.dipssur.com,"DIPS Institute of Management & Technology, Jalandhar (Id: C-10247)"
www.ihgi.in,Innocent Hearts Group of Institutions (Id: C-10355)
www.kclimt.com,KCL Institute of Management and Technology (Id: C-10473)
www.lkcengg.com,Lyallpur Khalsa College of Engineering  (Id: C-50848)
www.simtjalandhar.com,Sainik Institute of Management and Technology Jalandhar (Id: C-52298)
www.satyaminstitute.com,"satyam Institute of Management and Technology, Nakodar (Id: C-10330)"
www.sgtb.in,"S.G.T.B Institute of Management and IT, Bhogpur (Id: C-10331)"
,Shri Guru Ram Das ji collage of Management and Technology (Id: C-56198)
http://www.socialgroupofinstitutions.com,Social Institute of Management and Technology (Id: C-52627)
www.stsoldierpharmacy.com,"Soldier Institute of Pharmacy,Jalandhar (Id: C-10432)"
www.ssietm.com,"St. Soldier Institute of Engg. and Technology, Jalandhar (Id: C-10513)"
www.stsoldiergroup.in,St. Soldier Institute of Hotel Mangement and Catering Technology (Id: C-10401)
ssmti.in,"St. Soldier Management and Technical Institute, Jalandhar (Id: C-10321)"
,"BST College of Nursing,  Beharipur (Khera Dona),  Distt. Kapurthala (Id: C-29124)"
,"Bebe Nanki University College, Vill. Mithra (Id: C-27980)"
www.dipsedu.com,"DIPS College (Co-Education) Dhilwan, Kapurthala (Id: C-27885)"
www.dipsedu.com,"DIPS College of Education, Dhilwan, Distt Kapurthala (Id: C-27964)"
,"GNBL Ramgarhia College for Women,  Phagwara (Id: C-27864)"
www.gncphagwara.in,G.N. College Sukhchainana Sahib (Phagwara) (Id: C-27995)
gnkcspl.org,G. N. Khalsa College   Sultanpur Lodhi (Kapurthala ) (Id: C-27879)
,GN Navbharat College Narur Panchhat (Kapurthala) (Id: C-27955)
gnpkscollege.org,GN Prem Karamsar College Nadala (Kapurthala) (Id: C-27971)
WWW.gcbholath.com,Govt. College Bholath (Kapurthala) (Id: C-27892)
www.gorcollegewomen.co.in,GRD College for Women Phagwara (Id: C-27953)
www.gncewkpt.com,"Guru Nanak College of Education for Women, Kapurthala (Id: C-27983)"
www.gndurcspl.in,"Guru Nanak Dev University Regional Campus, Fattu Dhinga, Sultanpur Lodhi (Id: C-27922)"
www.hindukanyacollege.com,Hindu Kanya College Kapurthala (Id: C-27998)
www.kncw.org,Kamla Nehru College for Women Phagwara. (Id: C-27848)
www.kncwedu.org,"Kamla Nehru College of Education For Women, Phagwara (Id: C-27949)"
lkcedu.com,"Lord Krishna College of Education, Vill Dera Saidan, Sultanpur Lodhi, Kapurthala (Id: C-27894)"
www.davphg.org,Mohan Lal  Uppal  D.A.V.College Phagwara (Id: C-27962)
www.gckpt.com,NJSA Govt. College Kapurthala (Id: C-27976)
opminstitutes.com,"Om Prakash Memorial College of Education, Vill. Dyalpur, Tehsil Dhilwan, Kapurthala (Id: C-27941)"
rcephg.org,Ramgarhia College of Education Phagwara (Id: C-27906)
www.ramgarhia-college.com,Ramgarhia College Phagwara (Id: C-27846)
,"SANT BABA DALIP SINGH MEMORIAL KHALSA COLLEGE, DOMELI (Id: C-52380)"
www.shdkmv.com,Sant Hira Das Kanya Mahavidyalaya Kala Sanghian (Kapurthala) (Id: C-27936)
,SBDSM Khalsa College Domeli (Kapurthala) (Id: C-27994)
www.sdcollegespl.com,S.D. College for Women Sultanpur Lodhi (Kapurthala) (Id: C-27888)
,SPSK Khalsa College  Begowal  (Kapurthala) (Id: C-27899)
stsoldiergroup.in,St. Soldier College Hadiabad (Phagwara) (Id: C-27925)
acem.org.in,"Anand College of Engg. and Management, Sultnpur (Id: C-10288)"
www.aryaimt.com,Arya Institute of Management and Technology (Id: C-52060)
cemkpt.org,"College of Engg. and Management, Kapurthala (Id: C-10497)"
gnaedu.in,GNA Institute of Management and Technology (Id: C-10419)
pitk.ptu.ac.in,I.K.G.P.T.U. Main Campus (Id: C-51507)
www.mayurcollege.org,Mayur College Kapurthala (Id: C-52300)
www.pimk.ac.in,Punjab Institute of Management (Id: C-51769)
,Pyramid College of Business And Technology (Id: C-56022)
www.riet.ac.in,"Ramgarhia Institute of Engg. and Tech, Phagwara (Id: C-10279)"
www.rimas.ac.in,Ramgarhia Institute of Management and Advance Studies (Id: C-51666)
www.suskapurthala.com,SHAHEED UDHAM SINGH COLLEGE OF TECHNOLOGY (Id: C-52110)
www.allsaintsedu.com,"All Saints Institute of Medical Sciences & Research, On Sidhwan Canal, P.O. Jaspal Bangar, Ludhiana (Id: C-29122)"
bjsdentalcollege.com,"Baba Jaswant Singh Dental College Hospital & Research Institute, Sector 40, Urban Estate, Ludhiana (Id: C-29252)"
,"Bengal Institute of Health  Sciences, Village  Jalaldiwal, Teh. Raekot,  Distt. Ludhiana (Id: C-29207)"
www.cmcludhiana.in,"Christian Dental College, Brown Road, Ludhiana (Id: C-29150)"
www.cmcludhiana.in,"Christian Medical College, Brown Road, Ludhiana (Id: C-29209)"
www.cmcludhiana.in or www.cmcludhiana.org,"College of Nursing,  Christian Medical College,  Brown Road, Ludhiana (Id: C-29203)"
dmch.edu,"College of Nursing,  Dayanand Medical  College, Civil Lines,  Ludhiana (Id: C-29190)"
www.oswalcancerhospital.com,"College of Nursing,  Mohan Dai Oswal Cancer  Treatment & Research  Foundation, G.T. Road,  Sherpur Bye Pass,  Ludhiana-141009 (Id: C-29163)"
,"College of Nursing, Sigma  Nursing Training Institute,  Dakhni Bye Pass, Gill  Road, Ludhiana (Id: C-29206)"
www.cmcludhiana.in,"College of Physiotherapy, Christian Medical College, Ludhiana (Id: C-29135)"
www.dmch.edu,"Dayanand Medical College,Civil Lines, Ludhiana (Id: C-29255)"
www.gnes.in,"Guru Nanak College of  Nursing, P.O. Dehlon,  Gopalpur, Distt. Ludhiana (Id: C-29240)"
,"Institute of Nursing  Education, Guru Teg  Bahadur Sahib (C)   Hospital, Shastri Nagar,  Model Town, Ludhiana (Id: C-29140)"
www.college-kularhospital.com,"Kular College of Nursing,  VPO Kishangarh, Distt.  Ludhiana (Id: C-29113)"
www.ljminstituteofnursing.com,"Lajjiawati Jain Memorial  Nursing Institute, Barnala  Chowk, Raekot (Id: C-29196)"
,"Mata Saraswati Institute of  Nursing Education, VPO  Birmi, Distt. Ludhiana (Id: C-29223)"
www.nightingalenursinginstitute.com,"Nightingale College of  Nursing, VPO Narangwal  Kalan, Distt. Ludhiana (Id: C-29136)"
www.sanjeevaninursing.com,"Sanjeevani College of  Nursing, Village Daudpur,  Khanna-141417 (Id: C-29217)"
www.sksscon.com,"Shaheed Kartar Singh  Sarabha College of  Nursing, Sarabha, Distt  Ludhiana (Id: C-29237)"
www.sarabhadentalcollege.in,"Shaheed Kartar Singh Sarabha Dental College, VPO Sarabha, Distt. Ludhiana (Id: C-29126)"
www.ghgnursing.com,"Sri Guru Hargobind  College of Nursing,  Opposite Reliance Petrol  Pump, Raikot-141109 (Id: C-29179)"
www.svnursing.com,SWAMI VIVEKANAND COLLEGE OF NURSING (Id: C-49589)
,College of Dairy Science & Technology (Id: C-453)
,College of Fisheries (Id: C-452)
,College of Veterinary Science (Id: C-451)
,School of Animal Biotechnology (Id: C-449)
www.gnes.in,"Guru Nanak Ayurvedic Medical College & Research Institute, Malerkotla Road, VPO Gopalpur (Id: C-29218)"
,"Lord Mahavira Homeopathic Medical College, Kitchlu Nagar, Hehneman Road, Ludhiana (Id: C-29243)"
www.ayurvediccollegesarabha.com,"Shaheed Kartar Singh Sarabha Ayurvedic College & Hospital, VPO Sarabha (Id: C-29208)"
sgndhomoeopathiccollege.com,"Sri Guru Nanak Dev Homoeopathic Medical College, Canal Road, Barewal, Near Ayali Kalan, Near Punjab Agriculture University, Ludhiana (Id: C-29251)"
asinstitutes.com,"A.S. Group of Institutions, Khanna (Id: C-27620)"
www.bkctldh.org,"Baba Khajandas College of Management and Technology, Ludhiana (Id: C-10410)"
,"Baba Sri Chand College of Management , Nurpura (Id: C-30788)"
www.dimt.org.in,"Doraha Institute of management and Technology, Doraha (Id: C-10352)"
www.ghgcollegesadhar.org,"G.H.G. Khalsa College of Pharmacy, Gurusar Sadhar, Ludhiana (Id: C-10501)"
www.ggnimtldh.org,Gujranwala guru Nanak Institute of Management & Technology (Id: C-10385)
www.ggi.ac.in,GULZAR COLLEGE OF ENGINEERING (Id: C-51294)
www.ggi.ac.in,"Gulzar School of Management, Vill Libra (Id: C-10437)"
www.gndec.ac.in,"Guru Nanak Dev Engineering College, Ludhiana (Id: C-10381)"
www.gnimt.org,"Guru Nanak Institute of Management and Technology, Ludhina (Id: C-10492)"
www.gtbimtdakha.com,"Guru Teg Bahadur Institute of Management & Technology , Dakah (Id: C-10448)"
www.kimtludhiana.org,Khalsa Institute of Management and Technology for Women (Id: C-10477)
www.lcetldh.com,"Ludhiana College of Engg. and Technology, Ludhiana (Id: C-10459)"
www.lgc.edu.in,Ludhiana Group of Colleges (Id: C-10491)
www.mlbimt.com,M.L.B Institute of Management and Technology (Id: C-10347)
www.pcte.edu.in,"PCTE Group of Institutes, Jhande (Id: C-50904)"
www.pcte.edu.in,"Punjab College of Technical Education, Baddowal (Id: C-10418)"
www.pcte.edu.in,"Punjab College of Technical education, Jhande (Id: C-50905)"
www.sgrdimt.org,"Shri Guru Ram Das Institute of Mgt & Tech, VPO- Halwara (Id: C-10364)"
www.svtcollege.in,Swami Vivekanand Technical College (Id: C-54217)
www.sbs.ac.in,SYNETIC BUSINESS SCHOOL (Id: C-52106)
www.aryacollegeludhiana.com,Arya College (Id: C-29273)
www.ascwkhanna.com,"A.S.College for Women, Khanna (Id: C-29340)"
www.asckhn.com,A.S.College  Khanna (Id: C-29396)
www.ascekhn.com,"A.S.College of Education, Kalalmajra (Id: C-29423)"
www.babakundancollegeofeducation.com,"Baba Kundan Rural College Of Education, Kulliawal (Id: C-29339)"
www.sidhsarcollege.com,"Baba Sheehan Singh Gill Govt. College, Sidhsar (Id: C-29407)"
,Bajaj College (Id: C-51962)
bcminstitutes.org,"B. C. M. College of Education, Sector-32 A Urban Estate (Id: C-29395)"
www.bnsmgc.com,Bhai Nagahia Singh Memorial Girls College (Id: C-29358)
www.bcedldh.org,"Bhutta College of Education, Bhutta (Id: C-29281)"
www.ddjaineducation.com,"D.D.Jain College of Education, Kidwai Nagar (Id: C-29315)"
www.ddjaincollege.org,"DD Jain Memorial College for Women, Ludhiana (Id: C-31039)"
www.dce.org.in,"Doraha College of Education, Doraha (Id: C-29355)"
www.ggnkcl.co.in,G. G. N. Khalsa College (Id: C-29434)
www.sidhwankhurdeducation.com,"GHG Harparkash College Of Education for Women, Sidhwan Khurd (Id: C-29306)"
www.degree.ghgcollegesadhar.org,"G.H.G.Khalsa College, Gurusar Sadhar (Id: C-29285)"
www.ghgedu.com,G.H.G. Khalsa College of Education Gurusar Sadhar (Id: C-29345)
www.gmtcollege2005.com,"G.M.T. College of Education, Jalandhar Bypass (Id: C-29449)"
www.gcealour.org.in,"Gobindgarh College of Education, Alour, Khanna (Id: C-29384)"
www.gpcalour.com,"Gobindgarh Public College, Alour Khanna (Id: C-29305)"
,"Govind National College, Narangwal (Id: C-29264)"
www.gcgldh.org,Govt College for Women (Id: C-29394)
www.gckaramsar.com,"Govt College, Karamsar-Rara Sahib (Id: C-29364)"
,"Guru Gobind Singh Khalsa College for Women, Jhar Sahib (Id: C-29360)"
www.ggskcw.ac.in,"Guru Gobind Singh Khalsa  for Women, Kamalpura (Id: C-29405)"
www.ggskcew.ac.in,Guru Gobind Singh Khalsaof Education for Women (Id: C-29291)
www.ghgeducation.in,"Guru Hargobind College of Education,  Gondwal  Raikot (Id: C-29280)"
www.ghginstoflaw.com,"Guru Hargobind Institute Of Law for Women, Sidhwan Khurd (Id: C-29299)"
www.gnes.in,"Guru Nanak College of Education, Gopalpur (Id: C-29428)"
www.gngcldh.com,"Guru Nanak Girls College, Model Town, Ludhiana (Id: C-31048)"
www.gnwldh.com,"Guru Nanak Khalsa College for Women, Model Town (Id: C-29415)"
gnndoraha.edu.in,"Guru Nanak National College, Doraha (Id: C-29319)"
,"Guru Teg Bahadur National College, Dakha (Id: C-29350)"
www.klsdcollege.org,"Kamla Lohtia S.D College, Subhash Nagar (Id: C-29330)"
www.kcwludhiana.org,"Khalsa College for Women, Civil Lines (Id: C-29436)"
www.kcwsidhwan.org,"Khalsa College for Women,Sidhwan Khurd (Id: C-29351)"
lrdavjagraon.com,"Lajpat Rai DAV College, Jagraon (Id: C-29327)"
,"Mai Bhago College for Women, Ramgarh (Id: C-29335)"
www.malwaedu.in,"Malwa Central College of Education for Women, Ludhiana (Id: C-31054)"
malwacollege.org.in,"Malwa College Bondli, Samrala (Id: C-29381)"
www.mgkcollege.org,"Mata Ganga Khalsa College for Girls, Kottan (Id: C-29357)"
www.shahisportscollege.com,Mata Gurdev Kaur Memorial  Shahi  Sports College of Physical Education (Id: C-29374)
www.mtsmldh.com,"MTSM College for Women, Ludhiana (Id: C-31045)"
,Nankana Sahib College of  Education (Id: C-29438)
www.ncwmachhiwara.com,"National College for Women, Machhiwara (Id: C-29406)"
,Nightingale College of Education (Id: C-55482)
,"Panjab University Regional Centre, Ludhiana (Id: C-31038)"
www.partapcollege.com,"Partap College of Education, Hambran Road (Id: C-29279)"
www.ramgarhiacollege.com,"Ramgarhia Girls College, Miller Ganj (Id: C-29441)"
www.sadbhavnagroup.org,Sadhbhavna College of Education For Women Raikot (Id: C-29421)
WWW.SCDGOVTCOLLEGE.ORG,"S.C.D.Govt College, Ludhiana (Id: C-29293)"
www.sdpcollege.com,"SDP College for Women, Ludhiana (Id: C-31028)"
http://govtsciencecollegejagraon.com/,"S.Govt College of Science Education & Research, Jagraon (Id: C-29447)"
,Shree Atam Vallabh Jain College (Id: C-55524)
,"Sri Aurobindo College of  Commerce & Management, Jhande (Id: C-29296)"
,"Sri Ram College, Dalla (Id: C-29276)"
sggjgirlscollege.org,"Swami Ganga Giri Janta Girls College, Raikot (Id: C-29412)"
,Shri Dandi Swami Dharmsangh Sanskrit Mahavidyalaya (Id: C-53130)
www.motherchhankaur.ong,"Bibi Chhankaur College of  Nursing, Sardulgarh,  Mansa (Id: C-29114)"
www.sscgcbhikhi.com,"Shiv Shakti College of  Nursing, Bhikhi, Distt.  Mansa (Id: C-29153)"
www.sscgcbhikhi.in,SHIV SHAKTI AYURVEDIC MEDICAL AND HOSPITAL  (Id: C-55232)
www.bgc.edu.in,Bharat Institute of Engg. & Technology (Id: C-10389)
www.bgc.edu.in,"Bharat Institute of Management Studies , Vill Khara Khurd (Id: C-10499)"
www.gimt.gdews.com,"Gurdasidevi Institute of Management & Technology, Budhlada (Id: C-10345)"
,"Punjab Institute of Technology, Mansa (Id: C-54699)"
www.acebareta.com,Arihant College Of Education (Id: C-53131)
www.bhagwaticollege.in,"Bhagwati College of Education for girls, Bhikhi, Mansa (Id: C-22086)"
,BHAI BEHLO KHALSA GIRLS COLLEGE PHAFRE BAHI KE (Id: C-47286)
www.globalcollegemansa.com,GLOBAL COLLEGE OF HIGHER EDUCATION NAGAL KHURD (Id: C-47298)
www.gncbudhlada.org,"Guru Nanak College, Budhladha, Mansa (Id: C-22274)"
www.gcebhikhi.org,"Guru Nanak College of Education, Bhikhi, Mansa (Id: C-22182)"
www.gtbcemansa.org,"Guru Teg Bahadur College of Education, Dalelwala, Teh. Budhladha, Mansa (Id: C-22188)"
www.krishnacollegeralli.com,KRISHNA COLLEGE OF HIGHER EDUCATION VILL RALLI BUDHLADA (Id: C-49543)
www.mbceralla.com,"Mai Bhago College of Education (for girls ) Ralla , Mansa (Id: C-22221)"
www.mbdcralla.com,"Mai  Bhagoo Degree College (for girls) Ralla, Mansa (Id: C-22236)"
www.malwasardulewala.com,"Malwa College of Education, Sardulewala, Mansa (Id: C-22242)"
www.mctekhiala.wordpress.com,"Malwa College of Trainings and Education, Malakpur Khiala, Mansa (Id: C-22081)"
,"MALWA INSTITUTE OF HIGHER STUDIES, SARDULEWALA (Id: C-49400)"
mgurdevkaurei.org,"Mata Gurdev Kaur Memorial Education Institute (for girls), Bareta, Mansa (Id: C-22269)"
www.msdedu.ac.in,"MATA SITO DEVI COLLEGE OF EDUCATION,KOT DHARMU (Id: C-53231)"
,MATA SUNDARI UNIVERSITY GIRLS COLLEGE MANSA (Id: C-49546)
meeracollegeofeducation.com,"Meera College of Education, Mansa Road Sardulewala, Mansa (Id: C-22276)"
smilkhasinghei.org,"Milkha Singh Educational Institute, Bareta, Mansa (Id: C-22106)"
modernbhikhi.org,"Modern College of Education (for girls)  Bhikhi, Mansa (Id: C-22186)"
nc.bhikhi.org,"National College, Bhikhi, Mansa (Id: C-22175)"
www.nmgcmansa.ac.in,"Nehru Memorial Govt. College, Mansa (Id: C-22074)"
,"Punjabi University Baba Dhyan Dass Neighbourhood Campus, Jhunir (Id: C-22136)"
punjabiuniversity.ac.in,"Punjabi University Neighbourhood Campus, Ralla, Mansa (Id: C-22132)"
,S. Balraj Singh Bhundarh Memorial university College Sadulgarh (Id: C-22286)
,"S.D. Kanya Mahavidyala, Mansa (Id: C-22223)"
www.sscgcbhiki.in,"S.S. College for Girls, Bhikhi, Mansa (Id: C-22116)"
www.ssgcbhikhi.in,"S.S. College of Education for Girls, Bhikhi, Mansa (Id: C-22206)"
,S.S. Jain College of Ecucation (for  girls) Mansa (Id: C-22234)
,"The Royal Group of Colleges, Borawal (Id: C-51491)"
www.bmsnursing.com,"BABA MANGAL SINGH NURSING INSTITUTE, BARNALA ROAD, BUGHIPURA (Id: C-49590)"
www.babekegroupofinstitutes.com,"Babe Ke Institute of  Nursing, VPO Daudhar,  Distt.Moga (Id: C-29234)"
www.bgedmk.com,"Bhai Ghanaiya Ekta College of Nursing, Dharamkot (Id: C-51083)"
thaparfoundation.org,"Dr Shyam Lal Thapar  College of Nursing,  Amritsar Barnala Bypass  Road, Moga (Id: C-29138)"
www.indoamericancollege.com,"Indo American College of  Nursing, Amritsar Road,  Moga-142001 (Id: C-29195)"
www.llrin.ac.in,"Lala Laj Pat Rai Institute  of Nursing, Moga (Id: C-29128)"
www.sfcnursinginstitute.in,SFC INSTITUTE OF NURSING (Id: C-54415)
www.babekegroupofinstitutes.com,"Babe Ke Ayurvedic Medical College & Hospital, VPO Daudhar, Via Ajitwal (Id: C-29202)"
www.satyasaiayurveda.com,Sri Satya Sai Ayuvedic College and Hospital Moga (Id: C-51316)
,"Sri Satya Sai Murlidhar Ayurvedic College, G.T. Road, VPO Dunike, Moga (Id: C-29129)"
,"ALPINE INSTITUTE OF INFORMATION AND TECHNOLOGY,RODE (Id: C-51487)"
www.bisinstitutes.com,Baba Isher Singh Institute of Technology VPO-Gagra (Id: C-10282)
,"Baba Mangal Singh Institute of Management & Technology, Moga (Id: C-10313)"
www.bisinstitutes.com,"BIS Baba Isher Singh College of Engg & Technology, Gagra (Id: C-10338)"
www.dbfgi.com,"Desh Bhagat Foundation gruoup of Institutions, Moga (Id: C-10367)"
idealgirlscollege.org,"IDEAL INSTITUTE OF  MANAGEMENT AND  TECHNOLOGY, MANUKE GILL (Id: C-55066)"
www.isfcp.org,"ISF college of Pharmacy, Moga (Id: C-10398)"
llrcp.ac.in,"Lala Lajpat Rai College of Pharmacy , Moga (Id: C-10363)"
www.llriet.ac.in,"Lala Lajpat Rai Institute of Engg. & Tech., Moga (Id: C-10486)"
llrmimt.org,Lala Lajpat Rai Memorial Institute of Management and Technology (Id: C-10495)
,M.L.Memorial Technical College (Id: C-56401)
http://www.northwest.ac.in,North West Institute of Information Tech (Id: C-10273)
http://www.northwest.ac.in,North West Institute of Management & Technology (Id: C-29468)
,Punjab Institute of Technology Guru Teg Bahadurgarh  (Id: C-53835)
,SFC INSTITUTE OF MANAGEMENT AND TECHNOLOGY (Id: C-54422)
www.saintkabiriimt.com,St. Kabir Institute of Information and Management Technology (Id: C-10396)
www.adcollege.co.in,"Arjan Dass College, Dharamkot (Id: C-29413)"
www.babekegroupofinstitutes.com,"Baba Ke College of Education, Daudhar (Id: C-29400)"
bkcmlc.in,"Baba Kundan Singh Memorial  Law College, Dharmkot (Id: C-29408)"
www.bmsinstitutemoga.com,"Baba Mangal Singh Institute Of Education, Bughipura (Id: C-29309)"
www.dmcm157.com,"D.M.College, Moga (Id: C-31035)"
www.dmcedumoga.com,"D.M. College of Education, Moga (Id: C-31033)"
www.gncmoga.com,"GURU NANAK COLLEGE, MOGA (Id: C-50858)"
WWW.GCGTB.AC.IN,"Guru Nanak Govt College, Guru Teg Bahadurgarh (Id: C-29419)"
jagatsewakcollege.org,"Jagat Sewak Khalsa College For Women, Amargarh (Id: C-29260)"
http://lhrmcollege.com,"Lala Hans Raj Memorial College of Education, Bhangeria (Id: C-29401)"
http://www.llrgcdhudike.com,"Lala Lajpat Rai Govt. College, Dhudike (Id: C-29307)"
www.llrmce.org,"Lala Lajpat Rai Memorial College of Education, Dhudike (Id: C-29370)"
www.mceg.org,"Moga College of Education for Girls, Ghall Kalan (Id: C-29271)"
www.sbbsmgc.in,"Sant Baba Bhag Singh Memorial  College of Education for Girls, Sukhanand (Id: C-29287)"
www.sbbsmgc.in,"Sant Baba Bhag Singh Memorial Girls College, Sukhanand (Id: C-29375)"
www.sdsinstitutes.net,"Sant Darabara Singh College  for Women, Lopon (Id: C-29398)"
www.sdseducation.com,Sant Darbara Singh College  of Education for Women Lopon (Id: C-29445)
www.satyamcollageofeducation.com,"Satyam College of Education, Ghall Kalan (Id: C-29323)"
,"S.D. College for Women, Moga (Id: C-31034)"
www.skcollege.com,Sukhdeva Krishna Collegeof Education for Women (Id: C-29356)
,"Tagore College of Education, Fatehgarh (Id: C-29338)"
,"University College, Nihal Singh Wala, Moga (Id: C-29417)"
www.adesh.in,"College of Nursing, Adesh  Institute of Medical  Sciences, Kotkapura Road,  Muktsar (Id: C-29139)"
,"College of Physiotherapy, Adesh Institute of Medical Sciences, Kotkapura Road, Muktsar (Id: C-29158)"
,"Desh Bhagat Dental College & Hospital, Kotkapura Road, Muktsar (Id: C-29205)"
www.bfuhs.ac.in,"State Institute of Nursing & Paramedical Sciences, Badal (Id: C-29167)"
,BABA HIRA DASS JI COLLEGE OF VETERINARY PHARMACY (Id: C-56116)
www.gnamchmks.com,"Guru Nanak Ayurvedic Medical College, Barkandi Road, Near Ajit Cinema (Id: C-29125)"
www.maibhagogroup.org,"Mai Bhago Ayurvedic College (For Women), Ferozepur Road, Muktsar (Id: C-29242)"
www.bmscemuktsar.com,Bhai Maha Singh College of Engg. (Id: C-10294)
,Bhai Maha Singh College of Information Technology and life Science (Id: C-10479)
