www.atmanand.com,"Atamanand Teachers Training College, Ayurvedic College Road, Jhalamand Circle, Jodhpur (Id: C-37168)"
www.spssbharat.com,"Bharat Women B.Ed. College, Digari Kalan, Jodhpur (Id: C-37204)"
www.cmwbc.org,"Central Modern Women Tearchers Training College, Behind Ganesh Patrol Pump, Gujrawas, Banad Road,Jodhpur (Id: C-37156)"
,"Chopasni Teachers Training College, Chopasni, Jodhpur (Id: C-37197)"
www.drkwttcollege.org,"Dr. Radha Krishnan Women Tearchers Training College, Mathania Road, Daizer, Jodhpur (Id: C-37166)"
www.gdmcmt.org,"G.D. Memorial College, Sector-4, Kudi Bhagtasni Housing Board, Jodhpur (Id: C-37187)"
www.gbdc.in,Gokul Babu Degree College (Id: C-50853)
www.gdwttc.org,"Gomi Devi Women Teachers Traning College, Kudi Bhagtasani Housing Board, Jodhpur (Id: C-37173)"
,"GOVERNMENT COLLEGE, BALESAR (Id: C-50204)"
www.dce.rajathan.gov.in,"Government College, Bhopalgarh (Id: C-13231)"
,"GOVERNMENT COLLEGE, BILARA (Id: C-50414)"
,"GOVERNMENT COLLEGE, JODHPUR (Id: C-50203)"
,"Government College, Osian (Id: C-54677)"
www.dce.rajasthan.gov.in,"Government College, Phalodi (Id: C-13049)"
http://www.gramodaya.ac.in,"Gramodhyog Mahavidyalaya, Bilara (Id: C-13213)"
www.gsjmbc.com,"G.S. Jangid Teachers Training College for Women, Gangana (Id: C-13288)"
,"Gurukul Institute of Commerce and Advance Courses, Opp. N.S. Garden , Pal Road, Jodhpur (Id: C-37172)"
,"Gyandeep Shodh Avam Shikshan Sansthan , 78, Laxmi Nagar, Paota C-Road, Jodhpur (Id: C-37201)"
www.hhmhsmgc.com,H. H. Maharaja Hanwant Singh Memorial Girls College (Id: C-52373)
www.hkhcollege.org,"H.K. Hitech College, Mehran Apartment, Sardarpura , Jodhpur (Id: C-37171)"
,"Holy Sprite Institute of Technology, Science & Research College, Paota-C- Road, Jodhpur (Id: C-37181)"
,"Kanya Mahavidyalaya, Bilara (Id: C-13196)"
www.kmspm.com,"Keru Mahila Shikshak Prashikshan Mahavidyalaya, Keru (Id: C-13253)"
kmspm.org,"Kumodini Mahila Shikshak Prakshishan Mahavidyalaya. Sector-B, Bhagwati Colony,Near PWD, Jodhpur (Id: C-37170)"
www.lachoomemorial.org,Lachoo Memorial College of Science & Tech (Id: C-25193)
www.luckygroup.edu.in,"Lucky Institute of Professional Studies, ESI Hospital Road, Kamala Nehru Nagar, Jodhpur (Id: C-37188)"
,"Maharshi Dadhich Mahila Mahavidyalaya, Madhuvan Basni, Jodhpur (Id: C-37186)"
www.mpgmahavidyalaya.org,"Mahila Mahavidyalaya ,Kamala Nehru Nagar ,Soor Sagar Road ,Jodhpur (Id: C-37178)"
mttcjodhpur.org,"Mahila Teachers Training College, Soor Sagar Road, Kamla Nehru Nagar,Jodhpur (Id: C-37195)"
,"Mahila Vidhi Mahavidyalaya, Kamala Nehru Nagar, Soor Sagar Road, Jodhpur (Id: C-37162)"
mahipalshikshansansthan.org,"Mahipal Shikshan Sansthan, Tinwari (Id: C-13241)"
,"Marudhar Mahavidyalaya, 16-E-6 Chopasani Housing Board, Jodhpur (Id: C-37179)"
www.mayurakshi.in,"Marwar Shikshak Prakshikshan Mahavidyalaya, 107, Kamala Nehru Nagar, Jodhpur (Id: C-37157)"
marwarwinners.com,"MARWAR WINNERS COLLEGE, SOYLA, JODHPUR (Id: C-49626)"
,"Ma Saraswati B.Ed. College, 6/44, Kudi Bhagtasni Housing Board , Jodhpur (Id: C-37160)"
www.mammahilattc.org,MAULANA AZAD MUSLIM MAHILA T. T. COLLEGE (Id: C-52177)
www.mamttc.org,"Maulana Azad Muslim Tearchers Training College, Pal Link Road ,Kamla Nehru Nagar, Jodhpur (Id: C-37161)"
www.msavs.com,"Mayurakashi Women Teachers Training College, Mandal Nath Choraha, Jodhpur (Id: C-37158)"
,"Nakoda Parshvanath Jain Mahavidyalaya, Sardar School Campus, Jodhpur (Id: C-37159)"
,"Netraheen Vikas Sansthan, B.Ed. College, D- Sector,  Kamla Nehru Nagar, Jodhpur (Id: C-37189)"
www.somanicollege.in,"Onkarmal Somani College of Commerce, 1-Pulia,Chopasani Housing Board, Jodhpur (Id: C-37196)"
shrisabal.in,"Padam Shri Vijaydan Detha Mahila Mahavidyalaya, Borunda (Id: C-13088)"
www.pttcpc.com,"Peepar Teachers Training College, Peepar City (Id: C-13046)"
,"P.L.V. Memorial College, Shikargarh (Id: C-13136)"
www.rttca.in,"Rajasthan Teachers Training College, Aagoloi (Id: C-13099)"
,"RAJ COLLEGE, BILARA (Id: C-51756)"
www.rajmatavsttcollege.com,"Rajmata Vijay Raje Scindia, Teachers Training College, Near Pratap Nagar Thana, Kamla Neru Nagar Jodhpur (Id: C-37190)"
www.rsmkeru.com,ROOPA RAM SEVADA MAHAVIDHYALAYA KERU JODHPUR (Id: C-53229)
www.rskcfw.com,ROTARY SHYAM KUMBHAT COLLEGE FOR WOMEN (Id: C-50899)
http://rsmahilattcollege.com,"R.S. Mahila Teachers Training College, 4th Road,  Shakti Nagar, Paota C-Road, Jodhpur (Id: C-37165)"
www.msavs.com,"Sangh Mitra Teachers Training College, Mandal Nath Choraha, Jodhpur (Id: C-37177)"
www.smttc.in,"Sanskar Mahila Shikshan Prakshikshan Mhavidyalaya, Shanti Priya Nagar, OPP Dev Nagar, Jodhpur (Id: C-37193)"
,"Savitri Phoole Mahila Mahavidyalaya, Bagar Chowk, Jodhpur (Id: C-37176)"
www.sgktc.org,"Shah Goverdhanlal Kabra Teachers College ,Umaid Hospital Road ,Jodhpur (Id: C-37185)"
,"Shanti Devi B.Ed. College, 78, Laxmi Nagar, Paota C-Road, Jodhpur (Id: C-37154)"
,"SHRI AAIJEE MAHILA MAHAVIDYALAYA, BILARA (Id: C-50852)"
,"Shri I.G. Marwar Mahavidyalaya, Bilara (Id: C-13305)"
,"Shri Khaiteshwar Mahavidyalaya, Nandri (Id: C-13278)"
,"Shri Khatishwar B.Ed. College, Nandri (Id: C-13018)"
,"Shri Lal Bahadur Shastri Women Teachers Training College, 357, Laxmi Nagar, Jodhpur (Id: C-37182)"
,"SHRI LAL CHAND MILAP CHAND DHADHA JAIN COLLEGE, OSIAN (Id: C-50846)"
,"Shri Mahalaxmi Girls College, Sector-E, Pratap Nagar, Jodhpur (Id: C-37192)"
www.mahalaxmiedu.org,"Shri Mahalaxmi Mahila Shikshak Prashikshan Mahavidyalaya , Sector-E, Pratap Nagar, Jodhpur (Id: C-37203)"
,"Shri Nakoda Parshvanath Jain Mahavidyalaya, Jodhpur. (Id: C-54518)"
www.spspsrsmmv.com,"Shri Pustikar Shri Purohit Surajraj Roopadevi Smriti Mahila Mahavidyalaya, Siwachi Gate, Jodhpur (Id: C-37155)"
www.srnmmttc.org,"Shri R. N. Memorial Women Teachers Training College, Madhuban, Basani, Jodhpur (Id: C-37175)"
shrisabal.in,"Shri Sabal Mahila T.T. College, Borunda (Id: C-13183)"
shrisainathcollege.com,"Shri Sai Nath Mahila Shikshan Sansthan, Pipar City (Id: C-30910)"
,"Shri Shirdi Sai Baba Mahavidyalaya, Osian (Id: C-30888)"
,"SHRI SUMER MAHILA MAHAVIDYALAYA, MAHAMANDIR CIRCLE, JODHPUR (Id: C-50900)"
,"S.L.A. Golecha College, Khinchan (Id: C-13302)"
,"Smt. Seeta Devi Chunni Lal Baradia Government Girls College, Pipar City (Id: C-30907)"
www.suchetabedcollege.org,"Sucheta Kriplani T.T. College, Manaklav (Id: C-13125)"
www.tcmce.org,"Thomas Cangon Teachers Training College, Radhe Krishna Puram, Chokha Road, Jodhpur (Id: C-37164)"
,"Trinity Women Teachers Training College, 1st Tilak Nagar, Bhadwasia Road, Jodhpur (Id: C-37169)"
www.umraocollege.com,"Umrao B.Ed. College, Banar Road, Jodhpur (Id: C-37174)"
www.vidhyashram.in,"Vidhyashram Institute of Teachers Training, Uchiarda, Jodhpur (Id: C-37194)"
vyaseducations.org,"Vyas, B.Ed. College, Near Kudi Haud, Jodhpur (Id: C-37180)"
www.vyaseducation.org,"Vyas College of Commerce, Sardarpura 1-A Road, Jodhpur (Id: C-37184)"
,Faculty  of Applied Sciences (Id: C-44614)
,Faculty of Computer Application (Id: C-44612)
,Faculty of Education (Id: C-44613)
,Faculty of Engineering and Technology (Id: C-44611)
,Faculty of Law (Id: C-44609)
,Faculty of Management (Id: C-44615)
,Faculty of Medicine and Health (Id: C-44610)
,Faculty of Pharmaceutical Sciences (Id: C-44608)
,ACADEMY OF COMPUTER SCIENCE & APPLICATION JODHPUR (Id: C-31453)
,AISHWARYA COLLEGE OF EDUCATION (ACE) JODHPUR (Id: C-31296)
,H.K. HITECH JODHPUR (Id: C-31394)
,MAA BHAGWATI INFOTECH JODHPUR (Id: C-31583)
www.nift.ac.in,"NATIONAL INSTITUTE OF FASHION TECHNOLOGY, JODHPUR (Id: C-47473)"
,Aishwarya College of Management & Research Center-ACMRC (Id: C-25084)
www.gdmcmt.org,G.D. Memorial College of Mgmt & Tech (Id: C-25164)
www.jietjodhpur.ac.in,JIET SCHOOL OF ENGINEERING & TECHNOLOGY FOR GIRLS (Id: C-25092)
www.jietjodhpur.ac.in,JODHPUR INSTITUTE OF ENGINEERING & TECHNOLOGY (Id: C-25254)
www.luckygroup.edu.in,Lucky Institute of Professional Studies (Id: C-25201)
www.mecrc.org,"Marwar Engineering College & Research Center,Jodhpur (Id: C-25273)"
www.mitjodhpur.org,"Marwar Institute of Technology,Jodhpur (Id: C-25239)"
www.mayurakshi.in,"Mayurakshi Institutes of Engineering & Technology,Jodhpur (Id: C-25236)"
www.recjodhpur.org,"Raj Engineering College,Jodhpur (Id: C-25203)"
www.slbsjodhpur.com,"SLBS Engineering College,Jodhpur (Id: C-25256)"
www.vyaseducation.org,"Vyas College of Engineering and Technology, Jodhpur (Id: C-25136)"
www.vyaseducation.org,"Vyas Institute of Engineering & Technology,Jodhpur (Id: C-25133)"
www.vyaseduction.org,Vyas Institute of Management (Id: C-25222)
,"Govt. College of Physical, Jodhpur (Id: C-39057)"
www.education.rajasthan.gov.in,"DR S N MEDICAL COLLEGE AND HOSPITAL, JODHPUR (Id: C-47152)"
www.gdmcp.org,"G D MEMORIAL COLLEGE OF PHARMACY, JODHPUR (Id: C-47153)"
,"GOVERNMENT NURSING COLLEGE, JODHPUR (Id: C-47151)"
www.medicaleducation.rajasthan.gov.in,GOVERNMENT PHYSIOTHERAPY COLLEGE (Id: C-54521)
,"K S MEMORIAL COLLEGE OF NURSING, JODHPUR (Id: C-47154)"
www.marwarimuslim.org,"MAI KHADIJA INSTITUTE OF NURSING SCIENCES, JODHPUR (Id: C-47155)"
www.maip.in,"MAULANA AZAD INSTITUTEITUTE OF PHARMACY, JODHPUR (Id: C-47156)"
www.mayurakshi.in,"MAYURAKSHI COLLEGE OF NURSING, JODHPUR (Id: C-47157)"
,RGM COLLEGE OF NURSING (Id: C-51407)
,"SHREE LBS COLLEGE OF NURSING, JODHPUR (Id: C-47159)"
,"SHREE RAM SINGH VISHNOI MEMO BSC NURSING, JODHPUR (Id: C-47160)"
,"S K G MEMORIAL NURSING, JODHPUR (Id: C-47158)"
,"SLNG COLLEGE OF PHYSIOTHERAPY, JODHPUR (Id: C-47161)"
,"SRI LAL BAHADUR SHASTRI COLLEGE OF NURSING, JODHPUR (Id: C-47162)"
www.vyaseduction.org,"VYAS COLLEGE OF NURSING, JODHPUR (Id: C-47163)"
www.vyaseducation.org,"VYAS DENTAL COLLEGE AND HOSPITAL, JODHPUR (Id: C-51855)"
,Livestock Assistant Training College (AHDP 32) (Id: C-37145)
,Mayaurakshi Siksha Aur Vikas Sansthan (AHDP 33) (Id: C-37131)
,Shree S. L. Jangu Institute of Veterinary Science (AHDP 34) (Id: C-37114)
,Shri Lal Bhadur Shastri Research & Training Institute (AHDP 35) (Id: C-37113)
,"Rajeev Gandhi Ayurved Nursing Training Centre,Hindaun City (Id: C-26228)"
www.kamlabaijainsmbj.com,Shri Digambara Jain Adarsha Womens TT college (Id: C-26611)
,Sri Digambar Jain Adarsh ladies Sanskrit PG College (Id: C-26648)
,"Adarsh Phy. T.T. College, Suroth, Karauli (Id: C-19483)"
www.bmttcollege.org,"Bhagwan Mahaveer  T.T. College, Kachroli, Teh.Hindauncity, Karauli (Id: C-19432)"
,DARSHAN MAHAVIDYALAYA JHALRAPATAN JHALAWAR (Id: C-46361)
,Eklavya College (Id: C-56214)
,"GOVERNMENT COLLEGE, SAPOTRA (Id: C-49830)"
gchindaun.ac.in,"Govt. College, Hindauncity (Id: C-19363)"
www.dce.rajasthan.gov.in,"Govt. College, Karauli (Id: C-19406)"
www.dce.rajasthan.gov.in,"GOVT COLLEGE NADOTI, KARAULI (Id: C-46431)"
http://dce.rajasthan.gov.in,"Govt. College, Todabhim, Karauli (Id: C-19395)"
http://dce.rajasthan.gov.in/college/default.aspx,"Govt. Girls College, Karauli (Id: C-19398)"
www.motherteresattcollege.com,"Mother Teresa T.T. College, Gaddhipura, Hindauncity (Id: C-19356)"
www.neerajmemorialmahavidyalaya.in,"NEERAJ MOMORIAL MAHAVIDYLAYA, NAGAL SHERPUR, TODABHIM (Id: C-49831)"
,"Nehru T.T. College, Hindauncity, Karauli (Id: C-19468)"
www.nirmaleducation.com,"Nirmal Mahavidhyalaya, Hindauncity (Id: C-19387)"
www.nirmaleducation.org,"Nirmal T.T. College, Hindauncity, Karauli (Id: C-19381)"
www.rttkheda.com,"Rajasthan T.T. College, Karauli Road, Kheda, Hindauncity, Karauli (Id: C-19353)"
,"Rajiv Gandhi Mahavidhyalaya, Nadoti, Karauli (Id: C-19366)"
,"Rajiv Gramin Vikas College, Todabheem-Distt. Karauli (Id: C-19384)"
,RAMDULARI T T COLLEGE HINDAUNCITY (Id: C-46357)
,"RAMSAHAY GIRLS COLLEGE, KURGAON (Id: C-56746)"
,"RAMSAHAY MAHILA MAHAVIDHYALA, KURGAON (Id: C-56747)"
,"Satya Sadhna Mahavidhyalaya, Todabhim, Karauli (Id: C-19487)"
www.shriagrasensps-hnd.org,"Shree Agrasen Girls College, Hindauncity (Id: C-19430)"
NOT AVAILABLE,"Shree Maa Mahavidhyalaya,Sapotra, Karauli (Id: C-19456)"
www.shriagrasensps-hnd.org,"Shri Agarsen Mahila T.T. College, Hindauncity (Id: C-19416)"
,SMT INDIRA GANDHI PRIYA DARSHANI HINDAUNCITY (Id: C-46359)
www.sttckheda.com,"Sorabh T.T. College, Kheda, Hindauncity, Karauli (Id: C-19461)"
www.vmsseewa.com,"Veena Memorial Degree College, Karauli (Id: C-19469)"
,"Veena Memorial Law College, Karauli (Id: C-19365)"
vmsseewa.com,"Veena Memorial T.T. College,Padewa, Karauli (Id: C-19397)"
,"Vijay Singh Pathik Mahavidhyalaya, Srimahaveerji, Distt. Karauli (Id: C-19445)"
vspmsuroth.org,"Vivekanand T.T. College, Suroth, Karauli (Id: C-19400)"
,VEENA INSTITUTE OF TECHNICAL EDUCATION KARAULI (Id: C-31143)
,Rajiv Gandhi Livestock Assistant training center (AHDP 37) (Id: C-37121)
,Veena Memorial livestock Assistant Training School (AHDP 36) (Id: C-37110)
,"Arihan Ayurved Nursing Training Centre, Kota (Id: C-26237)"
,"Rajeev Gandhi Ayurved Nursing Training Centre, Kota (Id: C-26222)"
,Government Sanskrit UG College Chechat (Id: C-26542)
WWW.JLNSS.ORG,Jawaharlal Nehru TT college (Id: C-26539)
pldubeycollege.org,P.L. Dubey Memorial Sanskrit TT College (Id: C-26596)
,Shri Ana Sagar Mahila Shiksha Shastri Mahavidyalaya (Id: C-26651)
WWW.LBSTTCOLLEGE.COM,Shri Lalbahadur Shastri TT College (Id: C-26552)
,Shri Maharshi Dadhich Sanskrit TT college (Id: C-26536)
gasckota.com,Vittalnath Sadasiva Patak Government Sanskrit PG college Kota (Id: C-26594)
,"AANASAGAR MAHILA T T COLLEGE RANGBARI, KOTA (Id: C-46362)"
aklankeducation.com,"AKLANK GIRLS COLLEGE BASANT VIHAR, KOTA (Id: C-46429)"
www.aklankeducation.com,"Aklank T.T. College, Basant Vihar, Kota (Id: C-19470)"
einsteinwttc.com,"Albert Einstein Womens T.T. College,Basant Vihar, Kota (Id: C-19369)"
,"Arawali Kanya Mahavidhyalaya, Itawa, Kota (Id: C-19364)"
aimtkota.com,"ARYAN INSTITUTE OF MANAGEMENT KAITHUN ROAD, KOTA (Id: C-46364)"
,"Astha Mahavidhyalaya, Itawa, Distt. Kota (Id: C-19415)"
http://www.biekota.com,"Balaji Mahila T.T. College, Rangbari, Kota (Id: C-19359)"
www.bhartittcollege.org,"Bharti T.T. College, A 484, Industrial Area, Road No. 7, Anantpura, Kota (Id: C-19433)"
www.childrenttcollege.com,"Children T.T. College,Dadabari Chhota Choraha, Near Police Station, Kota (Id: C-19383)"
www.excellentlawcollege.in,"EXCELLENT LAW COLLEGE NAYAGAON BORABAS RAWATBHATA ROAD, KOTA (Id: C-46365)"
www.gopeshwerttcollege.org,"Gopeshwar T.T. College,Kanwarpura, Kota (Id: C-19410)"
,"Government Arts College, Kota (Id: C-56131)"
,"Government Arts Girls College, Kota (Id: C-56132)"
,"GOVERNMENT COLLEGE, SANGOD (Id: C-49828)"
,"Government Commerce Girls College, Kota (Id: C-56133)"
www.hte.rajasthan.gov.in,"Govt. College, Kota (Id: C-19412)"
www.dce.rajasthan.gov.in,"Govt. College, Ramganjmandi (Id: C-19482)"
dce.rajasthan.gov.in,"Govt. Commerce College, Kota (Id: C-19352)"
http://www.dce.rajasthan.gov.in,"Govt. J.D.B. Girls College, Kota (Id: C-19477)"
,"Govt. Law College, Kota (Id: C-19417)"
http://www.hcwtt.org,"Hitkari Mahila T.T. College, Garh Palace, Kota (Id: C-19476)"
,"JAIN DIWAKAR KAMALA MAHAVIDYALAYA, KOTA (Id: C-46381)"
www.jlnedu.com,"J.L.N.B. Ed. College, Sangod, Kota (Id: C-19418)"
www.jlnedu.com,"J L N DEGREE COLLEGE, SANGOD (Id: C-49829)"
www.jlnss.org,"J.L.N.T.T. College, Sakatpura, Kota (Id: C-19454)"
www.kautilyaedu.com,"Kautilya Mahila T.T. College,Rawatbhata Road, Nayagaon, Kota (Id: C-19396)"
www.lbsinstitution.com,"Lal Bahadur Shastri College, Mahaveer Nagar Extension, Kota (Id: C-19443)"
,"Lal Bahadur Shastri T.T. College,Mahaveer  Nagar Extension, Kota (Id: C-19489)"
,"Lord Buddha Institute of Tech. & Science College, Kota (Id: C-19422)"
www.lzebragirlscollege.com,"LZEBRA GIRLS COLLEGE 121 SHASTRI NAGAR, KOTA (Id: C-46367)"
www.maabhartipgcollegekota.com,"Maa Bharati PG College, Mahaveer Nagar-III, Kota (Id: C-19420)"
www.mbttcollege.edu.in,"Maa Bharti T.T. College, Talwandi, Kota (Id: C-19354)"
www.mpttcollege.org,"Maharana Pratap T.T. College, 234,Behind Central Academy School, Kota (Id: C-19462)"
,"Maharshi Chyavan Degree College, Sultanpur, Kota (Id: C-19429)"
http://www.mgttckota.com,"MAHARSHI GAUTAM T T COLLEGE VIR SAVARKAR NAGAR, KOTA (Id: C-46368)"
,"M.D. Mission College, Keshavpura, Kota (Id: C-19362)"
www.modiinstitutionskota.org,"Modi Institute of Management & Technoloy, Kota (Id: C-19464)"
,MODI LAW COLLEGE (Id: C-55736)
www.okedu.in,"Om Kothari Institute of Management & Research, Kota (Id: C-19486)"
www.okedu.in,"Om Kothari T.T. College, A-1, Special I.P.I.A., Kota (Id: C-19428)"
,"P.L. Dubey Memorial College, Jagpura, Near Jagpura Choki, Kota (Id: C-19449)"
www.pldubeycollege.org,"P.L. Dubey Memorial T.T. College, Jagpura, Near Jagpura Choki, Kota (Id: C-19386)"
www.pragaticollege.org,"Pragati T.T. College, Police Line, Baran Road, Kota (Id: C-19447)"
www.prashanticollege.org,"Prashanti T.T. College, Mahaveer Nagar, Kota (Id: C-19457)"
ramanandttcollege.org,"Ramanand T.T. College,Mahaveer Colony,  Rangpur Road, Station, Kota (Id: C-19357)"
www.srkpgorlsbedcollege.com,"Ramkrishan Parmahans T.T. College, Kaviraja Ki Haveli, Kotri Subjimandi, Kota (Id: C-19423)"
asistone.co.in,"R.D.R.K. Jatia College, Ramganjmandi (Id: C-19393)"
www.rmmwttcollege.com,"R.M. Memorial T.T. College, Jannayak Bhawan, Kherliphatak, Kota (Id: C-19399)"
,"Sacred Heart College, Naya Nohara, Baran Road, Kota (Id: C-19402)"
,"Sardar Patel Mahavidhyalaya, Itawa, Kota (Id: C-19475)"
www.womensarvodayattcollege.com,"Sarvodaya Mahila T.T. College, 20 Vigyan Nagar, Kota (Id: C-19436)"
www.sarvodayattcollege.com,"SARVODAYA T T COLLEGE VIGYAN NAGAR, KOTA (Id: C-46430)"
www.skmpsociety.com,"Shri Krishna T.T. College, Naya Nohara, Baran Road, Kota (Id: C-19355)"
www.skttcollege.com,"S.K.T.T. College, Chandrasel, Kota (Id: C-19370)"
www.srdmodicollege.com,"S.R.D. Modi College for  Woman, Kota (Id: C-19474)"
www.usmcoledu.com,"UMA SHIV T T COLLEGE BASANT VIHAR, KOTA (Id: C-46371)"
www.brightedu.org,BRIGHT COMPUTER KOTA (Id: C-31549)
,"INSTITUTE OF COMPUTER TECHNOLOGY, KOTA (Id: C-31149)"
,NLS INSTITUTE OF COMPUTER TECHNOLOGY KOTA (Id: C-31272)
,RAJRANI KALA & VYAVSAYIK PRASHIKSHAN SANSTHAN KOTA (Id: C-31374)
www.bkitkota.com,Bal Krishna Institute Of Technology (Id: C-51474)
www.gurukulkota.org,"Gurukul Institute of Engineering & Technology,Kota (Id: C-25271)"
www.maiitindia.org,"Maharishi Arvind International Institute of Technology,Kota (Id: C-25242)"
www.modiedukota.org,Modi Institute of Management & Technology (Id: C-25267)
www.mitkota.com,"Modi Institute of Technology,Kota (Id: C-25204)"
www.okedu.in,Om Kothari Institute of Management & Research (Id: C-25086)
www.macetkota.org,"Presidency College of Engineering, Kota (Id: C-25105)"
www.rmeckota.com,"R.N. Modi Engineering College,Kota (Id: C-25109)"
,"ARIHANT COLLEGE OF NURSING, KOTA (Id: C-47165)"
,"DASWANI COLLEGE OF PHYSIOTHERAPY, KOTA (Id: C-47166)"
www.daswanidentalcollege.com,Daswani Dental College and research Centre (Id: C-51398)
,DASWANI NURSING COLLEGE (Id: C-51466)
,"FLORENCE NURSING COLLEGE, KOTA (Id: C-47167)"
,"GOVERNMENT NURSING COLLEGE, KOTA (Id: C-47164)"
,GOVT. MEDICAL COLLEGE KOTA (Id: C-54352)
www.ibbcollege.com,"IBB COLLEGE OF PHYSIOTHERAPY, KOTA (Id: C-47168)"
www.jaiswalnursingcollege.com,"JAISWAL COLLEGE OF BSC NURSING, KOTA (Id: C-47169)"
www.kota-pharmacy.com,"KOTA COLLEGE OF PHARMACY, KOTA (Id: C-47170)"
,"M B COLLEGE OF NURSING, KOTA (Id: C-47171)"
,"M D MISSION COLLEGE OF NURSING, KOTA (Id: C-47172)"
,"OPERA COLLEGE OF NURSING, KOTA (Id: C-47173)"
www.savodayacollege.com,"SARVODAYA COLLEGE OF PARAMEDICAL AND NURSING EDUCATION, KOTA (Id: C-47174)"
,"SUDHA COLLEGE OF NURSING, KOTA (Id: C-47175)"
,M.D.M. Animal Husbandry College (AHDP 39) (Id: C-37112)
,Pashudhan Sahayak Prashikshan Sansthan (AHDP 40) (Id: C-37115)
,Sarvodaya animal Husbandry School (AHDP 41) (Id: C-37128)
,"COLLEGE OF AGRICULTURE, NAGAUR  (Id: C-51843)"
www.kuchamaneducation.com,"Marwar Health Care Society, Ayurved Nursing Training Centre,Kuchaman City (Id: C-26235)"
www.chhotidevi_bed.com,Choti Devi Memorial B.ed College (Id: C-26599)
shriranashikshashastricollege.com,Rana Shiksha Shastri Mahavidyalaya (Id: C-26638)
www.sssbcparbatsar.org,Seema Shiksha Shastri and B.ed College (Id: C-26600)
www.stsm.co.in,Seth Shri Surajmal Tapadiya Sanskrit UG college (Id: C-26606)
www.stsm.co.in,Shrimati Mohari Devi Tapadiya Sanskrit TT College (Id: C-26614)
,Shri Ramanuja Sanskrit UG college (Id: C-26545)
http://jvbi.ac.in/akkmcollege,Acharya Kalu Kanya Mahavidyalaya (Id: C-22472)
,"Adarsh B.Ed. College, Merta City (Id: C-13117)"
www.adarshcollege.co.in,"Adarsh College, Kuchaman City (Id: C-13069)"
,"Adarsh Mahavidyalaya, Gotan (Id: C-13225)"
,"Agarwal College, Merta City (Id: C-13030)"
,"Agarwal Girls College, Merta City (Id: C-13216)"
,"Agarwal Girls T.T. College, Merta City (Id: C-13163)"
,"Agarwal Shikshak Prashikshan Mahavidyalaya, Merta City (Id: C-13290)"
anjumanmakrana.in,"ANJUMAN MAHAVIDYALAYA, MAKRANA (Id: C-53569)"
,"Apex College, Makrana (Id: C-13102)"
,"Arunodaya Mahavidyalaya, Lunwa (Id: C-13028)"
www.balajieducation.in,"Balaji College, Asanpura, Kuchaman City (Id: C-30911)"
balajittcollege.com,"Balaji T.T. College, Kuchaman City (Id: C-13143)"
,"Bhartiya Teachers Training College, Ladnun (Id: C-13050)"
,"B.R. Kabra Kuchaman Mahila Shikshak Prashikshan Mahavidyalaya, Kuchaman City (Id: C-13031)"
,"B.R. Khokar Memorial Shikshak Prashikshan Mahavidyalaya, Kuchaman City (Id: C-13045)"
www.dce.rajasthan.gov.in,"B.R. Mirdha Government College, Nagour (Id: C-13147)"
,CAREER POINT COLLEGE (Id: C-56394)
www.chhotidevi-bed.com,"Choti Devi Memorial Girls B.Ed. College, Deedwana (Id: C-13106)"
,"Deedwana Mahila Mahavidyalaya, Deedwana (Id: C-13203)"
,"D R Memorial Mahila Mahavidyalaya, Kuchaman City (Id: C-30895)"
,"Dr Radhakrishan Women T.T. College, Kuchaman City (Id: C-30883)"
www.gncbasni.ccom,"GAREEB NAWAZ COLLEGE, BASNI (Id: C-50885)"
www.geetanjalibedcollege.com,"Geetanjali B.Ed. College, Borawar (Id: C-13013)"
www.dce.rajasthan.gov.in,"Government Bangur College, Deedwana (Id: C-13039)"
,"Government College, Degana (Id: C-54568)"
,"GOVERNMENT COLLEGE, JAYAL (Id: C-50584)"
,"Government College, Khinvsar (Id: C-55781)"
www.rajasthan.gov.in,"Government College, Manglana (Id: C-56012)"
dce.rajasthan.gov.in,"Government College, Merta City (Id: C-13107)"
,"Government Girls College, Nagaur (Id: C-29105)"
,"Government Law College, Nagaur (Id: C-29100)"
gvpsansthan.in,Gramothhan Vidyapeeth Sansthan (Id: C-13096)
,"Gurukul B.Ed. College, Gotan (Id: C-13189)"
,"Gurukul Mahila Mahavidyalaya, Siradhana (Id: C-30880)"
hindttcollege.com,Hind Teachers Training College (Id: C-30903)
,"H.P. Kabra College of Computer Science, Kuchaman City (Id: C-13220)"
,H P KABRA GIRLS COLLEGE (Id: C-50845)
,International College (Id: C-54529)
,"Jai Marudhar Kesari B.Ed. College, Merta City (Id: C-13271)"
www.jitm.co.in,"Jupiter College, Kuchaman City (Id: C-13218)"
,"Kuchaman College, Kuchaman City (Id: C-13215)"
www.kuchamaneducation.in,"Kuchaman College of Education, Kuchaman City (Id: C-13184)"
,"Maa Durga Mata B.Ed. College, Riyan Bari, Merta City (Id: C-30890)"
,"Maa Sharda B.Ed. College, Deh (Id: C-13254)"
,"Madi Devi Memorial B.Ed. College, Rianbari (Id: C-13186)"
mahadevbedcollege.org,"Mahadev B.Ed. College, Chhoti Khatu (Id: C-13135)"
www.mdcollegenagur.in,Maharshi Dadhichi Mahavidyalaya (Id: C-13132)
,"MAHATMA GANDHI COLLEGE, CHOTI KHATU, DIDWANA (Id: C-50792)"
,"Mahila Mahavidyalaya, Deedwana (Id: C-13010)"
,"Maitree Girls College, Riyan Bari (Id: C-30878)"
www.mttcmakrana.org,"Makrana T.T. College, Makrana (Id: C-13228)"
mdsmertacity.com,"Marudhar Defence Mahila Mahavidyalaya, Merta City (Id: C-13068)"
,"Marwar Mahavidyalaya, Degana Junction (Id: C-13277)"
,"Marwar Mahavidyalaya, Kuchaman City (Id: C-13294)"
,"Marwar Mahavidyalaya, Makrana (Id: C-13193)"
,"Marwar Mahavidyalaya, Parbatsar (Id: C-13206)"
shriramranashikshansansthan.com,"Matribhoomi Degree College, Borawar (Id: C-13282)"
,MAYUR MAHAVIDYALAYA (Id: C-56517)
www.newmodernkct.in,MODERN MAHILA MAHAVIDYALAYA (Id: C-51317)
,Nagaur Mahavidyalaya (Id: C-13118)
,"Naveen Vidyapeeth T.T. College, Nimbhijodha, Ladnun (Id: C-30908)"
navodayacollege.com,Navodaya College of Professional Education (Id: C-13080)
,Nischaya Mahavidyalaya (Id: C-13191)
prabhakardegreecollege.com,PRABHAKAR DEGREE COLLEGE (Id: C-52688)
www.rgccollegemaulasar.com,"Rajeev Gandhi Mahavidyalaya, Maulasar (Id: C-30891)"
,RANA ROYALS GIRLS COLLEGE  (Id: C-56213)
www.rntss.xearntechnology.com,"Ravindra Nath Tagore Shikshan Sansthan, Deedwana (Id: C-13217)"
,Sandesh College (Id: C-13168)
,"Santosh Mahavidyalaya, Riyan Badi (Id: C-50847)"
www.sttcollege.com,"Saraswati Teachers Training College, Banthri (Id: C-30898)"
www.sarvodayacollege.com,"Sarvodaya Shikshak Prashikshan Mahavidyalaya, Chenar (Id: C-13280)"
www.satguruttcollege.com,SATGURU TEACHER TRAiNING COLLEGE  (Id: C-54337)
www.seemamemorialbedcollegeparbatsar.com,"Seema Memorial B.Ed. College, Parbatsar (Id: C-13085)"
,"Seema Memorial Mahavidyalaya, Parbatsar (Id: C-13017)"
www.sbscollegenawa.org,"Shaheed Bhagat Singh College, Nawashahar (Id: C-13040)"
www.sbsttc.org,"Shaheed Bhagat Singh Shikshak Prashikshan Mahavidyalaya, Nawashahar (Id: C-13041)"
,"Shaheed Surendra Singh Mahavidyalaya, Kheenvsar (Id: C-30879)"
,"Sharda Mahila Mahavidyalaya, Degana Junction (Id: C-13262)"
www.shivamcollege.org,SHIVAM COLLEGE (Id: C-50821)
," Shree Tagore College, Kuchaman City (Id: C-13192)"
www.balajieducationhub.com,"Shri Balaji Mahavidyalaya, Deedwana (Id: C-55000)"
www.gcttcollege.in,"Shri Ganesh Chandra T.T. College, Jas Nagar, Merta City (Id: C-30877)"
,"Shri Krishna Mahila Mahavidyalaya, Ren (Id: C-55001)"
,"Shri Madhav Mahavidyalaya, Ladnun (Id: C-13097)"
,"Shri Madhav Shikshak Prashikshan Mahavidyalaya, Deedwana (Id: C-13038)"
,"Shri Narayan Teachers Training School, Kuchaman City (Id: C-13248)"
,"Shri Ram Mahila T.T. College, Borawar, Makrana (Id: C-30899)"
www.shriranamahilattcollege.com,"Shri Rana Mahila Teachers Training College, Borawar (Id: C-13274)"
,"Shri Sai Nath Teachers Training College, Badayali (Id: C-30905)"
,Shri Salasar Balaji College for Professional Studies (Id: C-54999)
,"Shri Sawai Mahavidyalaya, Deedwana (Id: C-30886)"
