,SWAMY VIVEKANANDHA COLLEGE OF PHARMACY (Inst. Code - 644) VIVEKANANDA MEDICAL CARE HOSPITLA (Id: C-56099)
vivekanandha.ac.in,"VIVEKANANDA DENAL COLLEGE FOR WOMEN (Inst. Code - 265), NAMAKKAL (Id: C-45915)"
vivekanandha.ac.in,"VIVEKANANDHA COLLEGE OF NURSING (Inst. Code - 097), NAMAKKAL  (Id: C-47515)"
vivekananda.ac.in,"VIVEKANANDHA MEDICAL CARE HOSPITAL (Inst. Code - 606), Elayampalayam (Id: C-54561)"
www.selvaminstitution.com,Selvam College of Physical Education (Id: C-7946)
www.angelsnkl.org,Angels College of Education (Id: C-14515)
www.amsedu.in,Annai Mathammal Sheela College of Education (Id: C-14741)
www.arputhajothi.cupelcms.com,Arputha Jothi College of Teacher Education (Id: C-14753)
www.chandrachellappan.com,Chandra Chellappan College of Education (Id: C-14879)
www.estheredu.org,Esther College of Education (Id: C-14992)
www.excelinstitutions.com,Excel College of Education (Id: C-14979)
www.gct.org.in,Gnanamani College of Education (Id: C-14636)
Kalaimagaleducation.org,Kalaimagal College of Education (Id: C-14483)
www.kamarajarinstitutions.org,Kamarajar College of Education (Id: C-14818)
www.truesdoway.com,Kandhaswamy College of Education (Id: C-14467)
www.kasthooribhagandhi.org.in,Kasthooribha Gandhi College of Education (Id: C-14671)
www.kingedu.in,King College of  Education (Id: C-14930)
www.kce.kongunaduvgp.com,Kongunadu College of Education (Id: C-14675)
www.krishnacollegeofeducation.org,Krishna College of Education for Women (Id: C-14757)
www.krishnasreecollegeofeducation.org,Krishnasree College of Education for Women (Id: C-14628)
www.krpinstitution.org,KRP College of Education (Id: C-14464)
www.ksmaniam.org,K.S. Maniam College of Education (Id: C-15017)
www.ksrcollegeofeducation.com,KSR College of Education (Id: C-14510)
www.mahendraeducation.org,Mahendhira  College of Education (Id: C-14768)
www.mahendraeducation.com,Mahendhra College of Education (Id: C-14961)
http://mshanthicollege.cupelcms.com,M. Shanthi College of Education (Id: C-14718)
www.muthayammal.net,MUTHAYAMMAL COLLEGE OF EDUCATION (Id: C-53462)
www.pced.paavai.edu.in,Paavai College of Education (Id: C-14713)
www.pgpedu.ac.in,PGP College of Education (Id: C-14587)
www.rainbowcoe.org.in,Rainbow College of Education (Id: C-14977)
www.rdce.cupelcms.com,Rajapalayam Deivanaiammal College of Education (Id: C-14933)
www.rasibedcollege.com,Rasi College of Education (Id: C-14397)
www.sreecollegeofeducation.org,Shree College of Education (Id: C-15037)
http://www.svmedu.org/,Shri Vidhya Mandhir College of Education (Id: C-14519)
,SREE COLLEGE OF EDUCATION (Id: C-56362)
www.shreeamirtha.com,Sri Amirtha College of Education (Id: C-14534)
www.srirengeswara.com,Sri Rengeswarer College of Education (Id: C-14469)
www.svaect.com,Sri Venglamani Amman College of Education (Id: C-14580)
www.rasividyamandireducol.org,"Sri Vidya Mandir College of Education, Namakkal (Id: C-14552)"
www.srpcollege.com,SRP College of Education (Id: C-14779)
WWW.STAR COLLEGE OF EDUCATION.COM,Star College of Education (Id: C-14865)
www.vvceducollege.org,Vidayaa Vikas College of Education (Id: C-14660)
www.vivekanandhacollegeofeducation.org,Vivekanandha College of Education for Women (Id: C-14697)
www.tanuvas.ac.in,"Veterinary College and Research Institute, Namakkal (Id: C-42739)"
www.dsengg.ac.in,Dhanalakshmi Srinivasan Engineering College (Id: C-24984)
www.elizabethcollege.in,ELIZABETH COLLEGE OF ENGINEERING TECHNOLOGY (Id: C-49139)
www.hasb.co.in,Holy Angels School of Business (New) (Id: C-24994)
www.roevertech.ac.in,Roever College of Engineering and Technology (Id: C-25009)
http://www.roeverengg.edu.in,Roever Engineering College (Id: C-25010)
http://rim.edu.in/,Roever Institute of Management (Id: C-25052)
www.sriengg.ac.in,Srinivasan Engineering College (Id: C-24995)
www.bdu.ac.in,"Bharathidasan University, Kurumbalur - 621 107 (Id: C-35876)"
www.dscollege.ac.in,"Dhanalakshmi Srinivasan College of Arts & Science for Women, Perambalur - 621 212. (Id: C-35868)"
www.jesi.in,"Elizabeth College of Arts & Science, Annamangalam (Po), Vepanthattai (Tk.) Perambalur - 620 102. (Id: C-35786)"
www.scaspblr.com,"Srinivasan College of Arts and Science, Perambalur - 621 212. (Id: C-35872)"
,"Sri Saradha College for Women, Perambalur - 621 212. (Id: C-35767)"
www.roevercollege.ac.in,"Thanthai Hans Roever College, Perambalur - 621 212. (Id: C-35768)"
www.roeveragri.ac.in,"THANTHAI ROEVER INSTITUTE OF AGRICULTURE AND RURAL DEVELOPMENT, PERAMBALUR (Id: C-45372)"
www.dsnursing.ac.in,"DHANALAKSHMI SRINIVASAN COLLEGE OF NURSING (Inst. Code - 227), PERAMBALUR (Id: C-45715)"
www.dsmedicalcollege.org,"DHANALAKSHMI SRINIVASAN MEDICAL COLLEGE AND HOSPITAL (Inst. Code - 455),  PERAMBALUR (Id: C-45716)"
www.srinursing.ac.in,"SRINIVASAN  COLLEGE OF NURSING (Inst. Code - 479), PERAMBALUR (Id: C-45717)"
www.roever.edu.in,"THANTHAI ROEVER COLLEGE OF NURSING (Inst. Code - 222), PERAMBALAUR (Id: C-45713)"
www.thrpc.ac.in,"THANTHAI ROEVER COLLEGE OF PHARMACY (Inst. Code - 138), PERAMBALUR (Id: C-45714)"
www.dscpe.co.in,DHANALAKSHMI SRINIVASAN COLLEGE OF PHYSICAL EDCUATION (Id: C-56146)
http://www.ccedn.org,Christian College of Education (Id: C-14453)
www.dscebed.co.in,Dhanalakshmi Srinivasan College of Education (Id: C-14772)
www.dscebedw.co.in,Dhanalakshmi Srinivasan College of Education  for Women (Id: C-14490)
www.edengardens.edu.co.in,Eden Gardens College of Education (Id: C-14650)
http://www.elizabethcollege.in,Elizabeth College of Education (Id: C-14804)
http://www.jesi.in,JRS College of Education (Id: C-14862)
sriramakrishnace.com,"Sri Ramakrishna College of Education, Perambalur (Id: C-14807)"
www.svcedu.co.in,"Swami Vivekananda College of Education, Perambalur (Id: C-14700)"
www.roever.edu.in,Thanthai Hans Roever College of Education (Id: C-14526)
wwwvidhyavikasplusedu.co.in,Vidhya Vikas Plus The Institute of Education (Id: C-14657)
www.chendhuran.in,Chendhuran College of Engineering and Technology (Id: C-25027)
www.kvim.ac.in,Karpaga Vinayaga Institute of Management (Id: C-24980)
www.kingsindia.net,Kings College of Engineering (Id: C-25038)
www.maietpdkt.org,Mahath Amma Institute of Engineering and Technology (Id: C-25005)
www.mar.edu.in,M.A.R. College of Engineering and Technology (Id: C-25042)
www.mnsk.ac.in,M.N.S.K. College of Engineering (Id: C-25049)
www.mookambigai.ac.in,Mookambigai College of Engineering (Id: C-25032)
mtcetilluppur@gmail.com,Mother Terasa College of Engineering and Technology (Id: C-25069)
www.mzcet.in,Mount Zion College of Engineering and Technology (Id: C-25024)
www.shanmuganathanengg.in,Shanmuganathan Engineering College (Id: C-25059)
www.sbec.edu.in,Sri Bharathi Engineering College for Women (Id: C-25017)
www.sec.ac.in,Sudharsan Engineering College (Id: C-24990)
svseducity.com,S V S International College of Architecture (Id: C-54559)
www.arputhacollege.in,"Arputha College of Arts & Science, Arputha Nagar, Vamban - 622 303. (Id: C-35852)"
www.auxiliumcollege.com,"Auxilium College of Arts and Science for Women,Regunathapuram Village,Alangudi Taluk,Pudukkottai District - 622 302. (Id: C-35807)"
,"Bharathidasan University Model College, Aranthangi - 614 616 (Id: C-35855)"
www.ganesarcollege.edu.in,"Ganesar Senthamil College of Arts and Science, Melaisivapuri - 622 403. (Id: C-35775)"
www.gacfwpdkt.com,"Government Arts College for Women, Pudukkottai - 622 001. (Id: C-35800)"
www.hhrajahs.com,"H.H. The Rajah's College, Pudukkottai - 622 001. (Id: C-35871)"
http://jjc.kvet.in,"J.J. College of Arts & Science, Namanasamuthiram, Pudukkottai - 622 404. (Id: C-35842)"
www.mahatmacollegespdkt.org,"Mahatma Arts and Science College, Ariyur Village, Iluppur Taluk, Pudukkottai District-622 101. (Id: C-35886)"
WWW.MOTHERTERASAKALVI.COM,"Mother Terasa College of Arts and Science, Mettusalai, Veerapatti Village, Illupur Post, Pudukkottai - 622 102. (Id: C-35879)"
www.nmectrust.org,"Naina Mohamed College of Arts & Science, Rajendrapuram, Pudukkottai - 614 624. (Id: C-35858)"
www.pabcas.in,"Paventhar Bharathidasan College of Arts & Science, Pudukkottai - 622 515. (Id: C-35827)"
www.sbcoll.edu.in,"Sri Bharathi Arts and Science College (W), Pudukkottai 622 303. (Id: C-35788)"
www.sca.ac.org,"Sudharsan College of Arts Science, Perumanadu Village, Iluppur Taluk,Pudukkottai - 622 104. (Id: C-35796)"
,"Agicultural College & Research Institute, KUDUMIYANMALAI (Id: C-51846)"
www.tnau.ac.in,AGRICULTURAL COLLEGE AND RESEARCH INSTITUTE (Id: C-51365)
www.doctorscollegeofnursing.com,"DOCTOR S  COLLEGE OF NURSING (Inst. Code - 314), PUDUKKOTTAI (Id: C-45706)"
http://kvcnursing.kvet.in,"KARPAGA VINAYAGA COLLEGE OF NURSING (Inst. Code - 288), PUDUKKOTTAI (Id: C-45705)"
www.ktsinstitutions.com,"KEERAI THAMILSELVAN COLLEG OF NURSING (Inst. Code - 322), PUDUKOTTAI (Id: C-45708)"
www.mzcn.in,"MOUNT ZION COLLEGE OF NURSING (Inst. Code - 331),  PUDUKKOTTAI  (Id: C-45711)"
www.johnspmc.com,"ST.JOHN'S  PARAMEDICAL COLLEGE (Inst. Code - 520), PUDUKKOTTAI (Id: C-45828)"
www.teamspecialityhospital.com,"TEAM SPECIALITY HOSPITAL (Inst. Code - 452), PUDUKKOTTAI (Id: C-45707)"
,MOTHER TERASA COLLEGE OF PHYSICAL EDUCATION (Id: C-56147)
auxiliumbed.com,Auxilium College of Education for Women (Id: C-14601)
www.bharathyvidyalaya.com,Bharathi Vidyalaya College of Education (Id: C-14608)
www.bharathividyalaya.com,Bharathi Vidyalaya College of Education (Women) (Id: C-14823)
www.bpacollegeofeducation.com,Bishop Packiam Arokiaswamy College of Education (Id: C-14681)
www.btkbedcollegevml.in,B.T.K.  College of Education (Id: C-14795)
http://jjeducation.kvet.in,J.J. College of Education (Id: C-14894)
,J.K. College of Education (Id: C-14428)
www.ktsinstitutions.com,Keerrai Thamil Selvan College of Education  for Women (Id: C-14499)
www.mahatmacollegespdkt.org,Mahatma College of Education (Id: C-14435)
www.motherteresacoedu.org,Mother Teresa College of Education (Id: C-33093)
www.motherterasakalvi.com,Mother Teresa College of Education for (w) (Id: C-14593)
www.ponmariedu.com,Ponmari College of Education (Id: C-15012)
www.srisubabharathi.org,Sri Bharathi College of Education (Id: C-15004)
citraeducationaltrust.com,Sri Manickam College of Education (Id: C-14829)
www.stxaviersedu.in,"St. Xaviers College of Education, Pudukkottai (Id: C-14420)"
www.sced.org.in,Sudharsan College of Education (Id: C-15000)
www.svscollegeofeducation.com,S.V.S College of Education (Id: C-14495)
www.motherterasakalvi.com,Terasa College of Education (Id: C-14621)
www.venkaedu.in,Venkatesvara College of Education (Id: C-14724)
,Vestley College of Education (Id: C-14391)
,ALAGAPPA UNIVERSITY CONSTITUENT COLLEGE (Id: C-47507)
,"ALAGAPPA UNIVERSITY EVENING COLLEGE, PARAMAKKUDI (Id: C-47508)"
,"ALAGAPPA UNIVERSITY EVENING COLLEGE, RAMANATHAPURAM (Id: C-47509)"
,"ALAGAPPA UNIVERSITY EVENING COLLEGE, RAMESWARAM (Id: C-47510)"
,"ALAGAPPA UNIVERSITY EVENING COLLEGE, THIRUPPUVANAM (Id: C-47512)"
WWW.ALU.IN,"ALAGAPPA UNIVERSITY EVENING COLLEGE, THONDI (Id: C-47511)"
caussanelcollege.com,"Caussanel College of Arts and Science, Muthuppettai (Id: C-28508)"
www.drzhcily.com,"Dr.Zakir Hussain College, Ilayangudi (Id: C-28533)"
,"GOVERNMENT ARTS AND SCIENCE COLLEGE, KADALADI (Id: C-50015)"
,"GOVERNMENT ARTS AND SCIENCE COLLEGE, MUDUKULATHUR (Id: C-50014)"
,"GOVERNMENT ARTS AND SCIENCE COLLEGE, THIRUVADANAI (Id: C-50013)"
www.gacwrmd.org,"Government Arts College for Women, Ramanathapuram (Id: C-28521)"
www.gacpmk.com,"Government Arts College, Paramakudi (Id: C-28523)"
www.ptmtmcollegekamuthi.com,"PMT Memorial college, Kamuthi (Id: C-28530)"
www.sgacrmd.org,"Sethupathi Govt. Arts College, Ramanathapuram (Id: C-28520)"
www.smcwomen.com,"Sonai Meenal Arts and Science College,  Mudukulathur (Id: C-28528)"
www.syedammalartscollege.com,"Syed  Ammal College of Arts and Science, Ramanathapuram (Id: C-28527)"
,"Syed Hameedha Arabic College, Kilakarai (Id: C-28511)"
www.shartsandscience-edu.in,"Syed Hameetha Arts and Science College, Kilakarai (Id: C-28531)"
www.thassim.in,"The Thassim Beevi Abdul Kadar College for Women, Kilakarai (Id: C-28515)"
,THIAGI THARMAKKAN AMIRTHAM COLLEGE OF ARTS AND SCIENCE (Id: C-47506)
www.annauniv.edu,"Anna University of Technology Madurai, Ramnad Campus (Id: C-26803)"
www.ganapathyenggcollege.com,"Ganapathy Chettiar College of Engineering and Technology, Paramakudi (Id: C-26801)"
www.msec.org.in,"Mohamed Sathak Engineering College, Kilakarai (Id: C-26795)"
www.syedengg.ac.in,"Syed Ammal Engineering College, Lanthai, Ramanathapuram Dist (Id: C-26807)"
,SARNA NURSING INSTITUTE(Inst. Code - 645) (Id: C-56098)
www.avbedpmk.com,Ayira Vaisya College of  Education (Id: C-14728)
www.csibedramnad.org,C.S.I. College of Education (Id: C-14423)
www.ganapathybed.com,Ganapathy College of Education (Id: C-14838)
www.sathaktrsut.org,"MOHAMMED SATHAK DASTHAGIR TEACHER TRAINING COLLEGE , RAMANATHAPURAM (Id: C-45847)"
www.mgredn.org,Puratchi Thalaivar Dr.M.G.R. College of Education (Id: C-14443)
www.rksamy.in,R.K. Samy College of Education (Id: C-14866)
www.thiagidharmakkancollege.org,Thiyagi Dharmakkan Amirtham  College of Education (Id: C-14877)
www.aecsalem.in,Annapoorana Engineering College (Id: C-36971)
www.avstech.org,AVS COLLEGE OF TECHNOLOGY ( FORMERLY AVS TECHNICAL CAMPUS) (Id: C-49140)
www.avsenggcollege.ac.in,AVS Engineering College (Id: C-36970)
www.biew.ac.in,Bharathiyar Institute of Engineering for Women (Id: C-37076)
www.dgct.ac.in,"DHIRAJLAL GANDHI COLLEGE OF TECHNOLOGY, SALEM (Id: C-45299)"
www.ganeshenggcollege.org,"GANESH COLLEGE OF ENGINEERING, SALEM (Id: C-45300)"
www.gcesalem.edu.in,Government College of Engineering (Id: C-36980)
iihtsalem.edu.in,"INDIAN INSTITUTE OF HANDLOOM TECHNOLOGY, SALEM (Id: C-56312)"
www.kbs.kiot.ac.in,"KNOWLEDGE BUSINESS SCHOOL, SALEM (Id: C-45301)"
http://www.kiot.ac.in,Knowledge Institute of Technology (Id: C-37058)
www.mahendracollege.com,Mahendra College of Engineering (Id: C-37074)
www.nsit.edu.in,Narasu's Sarathy Institute of Technology (Id: C-37026)
www.salemcollege.in,Salem College of Engineering and Technology (Id: C-37023)
www.shreesathyam.edu.in,"SHREE SATHYAM COLLEGE OF ENGINEERING AND TECHNOLOGY, SALEM (Id: C-45302)"
www.sonatech.ac.in,Sona College of Technology (Id: C-37028)
www.sct.ac.in,Spectrum College of Technology (Id: C-56093)
www.ganeshbusinessschool.org,Sri Ganesh School of Business management (Id: C-37062)
www.shanmugha.edu.in,"SRI SHANMUGHA COLLEGE OF ENGINEERING AND TECHNOLOGY, SALEM (Id: C-45303)"
www.srscet.com,SRS College of Engineering & Technology (Id: C-36932)
www.tagoreiet.ac.in,Tagore Institute of Engineering and Technology (Id: C-37029)
www.kavery.org.in,The Kavery College of Engineering (Id: C-37040)
www.kaveryengg.com,The Kavery Engineering College (Id: C-36948)
www.vysyamit.in,Vasavi Vidya Trust Group of Institutions Faculty of MBA (Id: C-36949)
www.vsagroup.ac.in,VSA Educational and Charitable Trusts Group of Institutions (Id: C-36993)
,AET Arts & Science College (Id: C-9504)
,Annai Terasa Arts & Science College (Id: C-9546)
www.avscollege.ac.in,A.V.S College of Arts & Science (Id: C-9550)
www.bwc.ac.in,Bharathiyar Arts & Science College (W) (Id: C-9516)
cenneysinstitute.com,Chenneys Institute of Hotel Management (Id: C-9558)
www.gemgates.ac.in,Gem Gates Arts & Science College (Id: C-9565)
www.gacsalem7.co.in,Government Arts College (Id: C-9517)
www.govtwomencollegeslm8.org,Government Arts College for Women (Id: C-9554)
www.jairamcollege.org,Jairam Arts & Science College (Id: C-9535)
www.kailashcollege.org,Kailash  Womens College (Id: C-9553)
www.maisuriiwomenscollege.org,MAISURII WOMENS COLLEGE OF ARTS AND SCIENCE (Id: C-52916)
minervajkpm@gmail.com,Minerva College of Arts & Science (Id: C-9495)
www.muthayammal.co.in,"Muthayammal Memorial College of Arts and Science, Rasipuram (Id: C-51857)"
,"OM MURUGA COLLEGE OF ARTS AND SCIENCE , SINGIRIPATTI (Id: C-48533)"
www.paavendharinstitutions.com,Paavendar College of Arts & Science (Id: C-9508)
www.pvascw.org,Padmavani Arts & Science College for (W) (Id: C-9530)
www.periyaruniversity.ac.in,"PERIYAR UNIVERSITY COLLEGE OF ARTS AND SCIENCE, IDAPPADI (Id: C-47502)"
www.periyaruniversity.ac.in,"Periyar University College of Arts & Science,mettur (Id: C-9566)"
,"ROYAL COLLEGE OF ARTS AND SCIENCE, MASILAPALAYAM (Id: C-47503)"
,Salem Christian College of Arts & Science (Id: C-9556)
www.kongunaadu.org,Salem Kongunadu Arts & Science (Id: C-9520)
www.sowdeswari.org,Salem Sowdeswari College (Id: C-9548)
www.shevaroysarts.org,"SHEVAROYS COLLEGE OF ARTS AND SCIENCE, YERCAUD (Id: C-47504)"
WWW.SHEVAROYSCATERINGCOLLEGE.COM,Shevaroys College of Hotel Managemnt & Catering Technology (Id: C-9484)
www.sakthikailashcollege.org,SHRI SAKTHIKAILASSH WOMEN'S COLLEGE SALEM (Id: C-9532)
www.psginstitutions.com,Siri PSG Arts & Science College for Women (Id: C-9509)
www.sbmcollege.com,Sri Balamurugan College of Arts & science (Id: C-9549)
www.ganeshcollege.org,Sri Ganesh College of Arts & Science (Id: C-9559)
,Srii Jayajothi College of Arts and Science for Women (Id: C-51813)
,SRI KAILASH WOMENS COLLEGE (Id: C-54414)
www.srisaradacollege.ac.in,Sri Sarada College for Women(Autonomous) (Id: C-9552)
www.ssnc.org.in,Sri Sarada Nicketan College of Arts & Science for Women (Id: C-9538)
www.svmcollege.com,Sri Vidhya Mandir College of Arts & Science (Id: C-9568)
www.vidhyaacollege.com,Vidhyaa Arts & Science College (Id: C-9514)
www.vivekanandha.ac.in,"Vivakananadha Arts and Science College for Women, Sankari (Id: C-51856)"
www.vicas.org,Vivekanandha College of Arts & Science (W) (Id: C-9488)
www.vysyacollege.org,Vysya College (Id: C-9498)
www.centrallawcollege.com,"Private Law College, Salem (Id: C-39279)"
www.amch.in,"ANNAPOORANA MEDICAL COLLEGE AND HOSPITAL (Inst. Code - 491), SALEM (Id: C-45704)"
gmkmc.ac.in," GOVERNMENT MOHAN KUMARAMANGALAM MEDICAL COLLEGE, COLLEGE OF NURSING, (Inst. Code - 401), SALEM (Id: C-49069)"
www.gmkmc.ac.in,"GOVERNMENT MOHAN KUMARAMANGALAM MEDICAL COLLEGE (Inst. Code - 010), SALEM (Id: C-45690)"
www.jkkn.ac.in,"J.K.K. NATARAJAH COLLEGE OF PHARMACY (Inst. Code - 032), SALEM (Id: C-45689)"
www.kamalacollegeofnursing.com,"KAMALA COLLEGE OF NURSING, SALEM (Id: C-50937)"
www.salempolyclinic.com,"M/s SALEM POLYCLINIC , (Inst. Code - 626), Salem (Id: C-51890)"
www.priyamspecialityhospitals.com,PRIYAM INSTITUTION OF PARAMEDICAL SCIENCES (Inst. Code - 636) (Id: C-56104)
rkeducationcom.in,"R.K. PARA MEDICAL COLLEGE (Inst. Code - 528), SALEM (Id: C-48986)"
www.smrft.org,"SHANMUGA COLLEGE OF NURSING, SHANMUGA INSTITUTE OF PARA MEDICAL SCIENCES (Inst. Code - 158), SALEM (Id: C-45695)"
www.shribharaninursingcollege.org,"SHRI BHARANI COLLEGE OF NURSING (Inst. Code - 334), SALEM (Id: C-45700)"
www.sivarajcolleges.org,"SIVARAJ HOMOEOPATHIC MEDICAL COLLEGE AND RESEARCH INSTITUTE (Inst. Code - 211), SALEM (Id: C-45696)"
www.sivarajcolleges.org,"SIVARAJ NATUROPATHY AND YOGA MEDICAL COLLEGE (Inst. Code - 133), SALEM (Id: C-45693)"
www.sivarajcolleges.org,"SIVARAJ SIDDHA MEDICAL COLLEGE (Inst. Code - 329), SALEM (Id: C-45699)"
www.spcinenr.com,"SPC INSTITUTE OF NURSING EDUCATION AND RESEARCH (Inst. Code - 591), SALEM (Id: C-49070)"
www.srigokulamcollegeofnursing.org,"SRI GOKULAM COLLEGE OF NURSING (Inst. Code - 217), SALEM (Id: C-45697)"
,"SRI GOKULAM HOSPITAL (Inst. Code - 361), SALEM (Id: C-45701)"
www.skinear.co.in,"SRI KRISHNA INSTITUTE OF NURSING, (Inst. Code - 620), Salem (Id: C-51888)"
www.icmcorphanage.org,"ST. BONNIE WHITE COLLEGE OF NURSING (Inst. Code - 478), SALEM (Id: C-45703)"
www.vivekanandha.ac.in,"SWAMY VIVEKANANDHA COLLEGE OF PHARMACY (Inst. Code - 059), SALEM (Id: C-45691)"
www.vivekanandha.ac.in,"VIVEKANANDA (RABINRANATH TAGORE) NURSING COLLEGE  FOR WOMEN (Inst. Code - 235), SALEM (Id: C-47569)"
www.srisaradaphyedu.in,Sri Sarada College of Physical Education for Women (Id: C-7940)
www.amerdavikascollege.org,Amerda Vikas College of Education (Id: C-14618)
www.avsce.org,A.V.S. College of Education (Id: C-14431)
www.bced.ac.in,Bharathiyar College of Education (Id: C-14921)
www.sribalakrishnainstitutions.com,Dhanam College of Education (Id: C-14470)
collegeofeducation.net.in,Dr. Nagarathinams College of Education (Id: C-14395)
www.ganesheducation.com,Ganesh  College of Education (Id: C-14806)
-,Gangaa College of Education (Id: C-14748)
www.htpcollegeofeducation.in,HTP College of Education (Id: C-14891)
www.kevicollege.com,Kevi Womens  College of Education (Id: C-14726)
www.kongunaadu.org,Kongunadu College of Education (Id: C-14672)
www.kongunaadu.org,Kongunadu College of Education for  Women (Id: C-14643)
www.kscollegeedu.org,K.S. College of Education (Id: C-14662)
www.mahendraeducation.com,Mahendra College of Education (Id: C-14605)
maruthicollegeedu.org,Maruthi College of Education (Id: C-14738)
www.padmavanicollege.org,Padmavani College of Education (Id: C-15015)
www.psginstitutions.com,PSG College of Education (Id: C-14440)
www.rtcew.com,Rabindharanath Tagore College of Education for Women (Id: C-14691)
www.sengunthareducationalboard.org,Sengunthar College of Education (Id: C-14812)
www.sk-ce.org,Shakthi Kailash College of Education for Women (Id: C-14461)
www.sriganeshbedcollege.org,Sri Ganesh College of Education (Id: C-14890)
www.srijayajothicollege.com,Sri JayaJothi College of Education (Id: C-14832)
www.srisaradhacollege.org,Sri Sarada Institute for Teacher Training (Id: C-14941)
www.basilbed.org,St. Basil College of Education for Women (Id: C-14554)
www.stgracellianbed.org,St. Grace Lilian College of Education (Id: C-15020)
www.tagorecollegeofeducation.in,Tagore College of Education (Id: C-14752)
www.kaveryinstitutions.com,The Kavery College of Education (Id: C-14504)
www.kaveryinstitutions.com,The Kavery College of Education for Women (Id: C-14953)
www.sritpt.com,Thiagarajar College of Education (Id: C-14523)
www.vettrivelcollege.com,Vettri Vel College of Education (Id: C-14509)
www.vbced.com,Viswa Bharathi College of Education (Id: C-14822)
www.vysyaeducation.org,Vysya College of Education (Id: C-14937)
www.vmaconslm.edu.in,Vinayaka Mission's Annapoorana College of Nursing (Id: C-10218)
www.vinayakamission.com,Vinayaka Mission's College of Pharmacy (Id: C-10216)
NIL,Vinayaka Mission's College of Physiotherapy (Id: C-10220)
www.vmhmc.edu.in,Vinayaka Mission's Homeopathic Medical College (Id: C-10225)
www.vinayakamission.com,Vinayaka Mission's Kirupananda Variyar Arts and Science College (Id: C-10222)
www.vmkvec.ac.in,Vinayaka Mission's Kirupananda Variyar Engineering College (Id: C-10214)
www.vmkvmc.edu.in,Vinayaka Mission's Kirupananda Variyar Medical College and Hospital (Id: C-10219)
www.vmsdcsalem.com,Vinayaka Mission's Sankarachariyar Dental College (Id: C-10221)
www.agacollege.org,"Alagappa Government Arts College, Karaikudi (Id: C-28526)"
www.anandacollege.org,"Ananda College, Devakottai (Id: C-28510)"
apsacollege.com,"Arumugam Pillai Seethaiammal College, Tiruppathur (Id: C-28532)"
www.umayalwomenscollege.co.in,"Dr. Umayal Ramanathan College for Women, Karaikudi (Id: C-28518)"
www.gacwsvga.in,"Government Arts College for Women, Sivaganga (Id: C-28524)"
www.idhayasarugani.in,"Idhaya College for Women, Sarugani (Id: C-28509)"
www.msnpioneermeenakshicollege.org,"Madurai Sivakasi Nadar Pioneer Meenaksmi Women college, Poovanthi (Id: C-28534)"
,"Matha College of Arts and Science, Manamadurai (Id: C-28519)"
www.nsascollege.in,"NACHIAPPA SWAMIGAL ARTS AND SCIENCE COLLEGE, KOVILOOR (Id: C-50206)"
www.rdgacollege.in,"Raja Doraisingam Government Arts College, Sivaganga (Id: C-28512)"
Nil,"Ramasamy Tamil College, Karaikudi (Id: C-28525)"
www.sacollege.net,"Seethalakshmi Achi College for Women, Pallathur (Id: C-28516)"
,"SINGAI SITHAR AYYA COLLEGE OF ARTS AND SCIENCE, A THEKKUR (Id: C-50207)"
www.sreesevuganannamalaicollege.org.in,"Sree Sevugan Annamalai College, Devakottai (Id: C-28535)"
ssnc.blissfest@gmail.com,"Sri Sarada Niketan college for Women, Amaravathipudur (Id: C-28513)"
,VIDHYAA GIRI COLLEGE OF ARTS AND SCIENCE (Id: C-56415)
www.vssgac.org,"VSS Government Arts College, Poolankurichi (Id: C-28522)"
www.accet.in,"Alagappa Chettiar College of Engg &Tech, Karaikudi (Id: C-26789)"
www.cecri.res.in,"Central Electro Chemicals Researh Institute, Karaikudi (Id: C-26800)"
www.kitandkimtechnicalcampus.org,"KARAIKUDI INSTITUTE OF TECHNOLOGY AND KARAIKUDI INSTITUTE OF MANAGEMENT, KARAIKUDI (Id: C-45319)"
www.klnce.edu,"K.L.N. College of Engineering Pottapalayam, Sivagangai Dist (Id: C-26785)"
www.klncit.edu.in,"K.L.N. College of Information Technology, Pottapalayam, Sivagangai Dist (Id: C-26812)"
www.maduraitech.edi.in,"Madurai Institute of Engineering and Technology, Sivagangai (Id: C-26793)"
www.psyec.edu.in,"Pandiyan Saraswathi Yadav Engineering College, Arasanoor, Sivagangai (Id: C-26775)"
www.pannaicet.org,"Pannai College of Engineering and Technology, Manamadurai, Sivagangai Dist (Id: C-26798)"
www.raajaraajan.org,"Sri Raaja Raajan College of Engineering and Technology, Karaikudi (Id: C-26804)"
www.smcet.edu.in,"St. Michael College of Engineering and Technology, Kalayarkoil, Sivagangai Dist (Id: C-26808)"
www.vickramce.org,"Vickram College of Engineering, Madurai Sivagangai Road, Enathi (Id: C-26777)"
-,"MATHA COLLEGE OF NURSING (Inst. Code - 096), SIVAGANGA (Id: C-45751)"
www.rassacademy.com,"RASS ACADEMY COLLEGE OF NURSING (Inst. Code - 228), SIVAGANGA (Id: C-45752)"
NIL,"SIVAGANGAI GOVERNMENT MEDICAL COLLEGE (Inst. Code - 572), SIVAGANGAI (Id: C-47559)"
,Koviloor Andavar College of Physical Education (Id: C-7941)
www.annaitheresacollegeofedu.com,Annai Teresa College of Education (Id: C-14540)
apsacoedu.com,Arumugam Pillai Seethai Ammal College of Education (Id: C-14452)
www.mathabedcollege.org,Matha College of Teacher Education (Id: C-14902)
www.psyce.org.in,P.S.Y. College of Education (Id: C-14802)
www.rced.co.in,Roseline College of Education (Id: C-14882)
shanthacollege.com,SANTHA COLLEGE OF EDUCATION (Id: C-51293)
www.aeact.org,S.Preethi B.Ed College of Education (Id: C-14648)
www.raajaraajanedu.com,Sri Raaja Raajan College of Education (Id: C-14588)
